final_institution,post_subinstitution,original_institution
THE BURNHAM INSTITUTE,THE BURNHAM INSTITUTE,THE BURNHAM INSTITUTE
THE COOPER INSTITUTE,THE COOPER INSTITUTE,THE COOPER INSTITUTE
"THE H. LEE MOFFITT CANCER CENTER AND RESEARCH INSTITUTE, INC.","THE H. LEE MOFFITT CANCER CENTER AND RESEARCH INSTITUTE, INC.","THE H. LEE MOFFITT CANCER CENTER AND RESEARCH INSTITUTE, INC."
THE INSTITUTE FOR SYSTEMS BIOLOGY,THE INSTITUTE FOR SYSTEMS BIOLOGY,THE INSTITUTE FOR SYSTEMS BIOLOGY
THE J. DAVID GLADSTONE INSTITUTES,THE J. DAVID GLADSTONE INSTITUTES,THE J. DAVID GLADSTONE INSTITUTES
THE JACKSON LABORATORY,THE JACKSON LABORATORY,THE JACKSON LABORATORY
THE MOUNT DESERT ISLAND BIOLOGICAL LABORATORY,THE MOUNT DESERT ISLAND BIOLOGICAL LABORATORY,THE MOUNT DESERT ISLAND BIOLOGICAL LABORATORY
THE NEW SCHOOL,NEW SCHOOL UNIVERSITY,NEW SCHOOL UNIVERSITY
THE NEW YORK ACADEMY OF MEDICINE,THE NEW YORK ACADEMY OF MEDICINE,THE NEW YORK ACADEMY OF MEDICINE
THE PARKINSONS INSTITUTE,THE PARKINSON'S INSTITUTE,THE PARKINSON'S INSTITUTE
THE QUEENS MEDICAL CENTER,THE QUEEN'S MEDICAL CENTER,THE QUEEN'S MEDICAL CENTER
THE SALK INSTITUTE FOR BIOLOGICAL STUDIES,THE SALK INSTITUTE FOR BIOLOGICAL STUDIES,THE SALK INSTITUTE FOR BIOLOGICAL STUDIES
"THE WINIFRED MASTERSON BURKE MEDICAL RESEARCH INSTITUTE, INC.","THE WINIFRED MASTERSON BURKE MEDICAL RESEARCH INSTITUTE, INC.","THE WINIFRED MASTERSON BURKE MEDICAL RESEARCH INSTITUTE, INC."
THOMAS JEFFERSON UNIVERSITY,THOMAS JEFFERSON UNIVERSITY,THOMAS JEFFERSON UNIVERSITY
TORREY PINES INSTITUTE FOR MOLECULAR STUDIES,TORREY PINES INSTITUTE FOR MOLECULAR STUDIES,TORREY PINES INSTITUTE FOR MOLECULAR STUDIES
TRANSLATIONAL GENOMICS RESEARCH INSTITUTE,TRANSLATIONAL GENOMICS RESEARCH INSTITUTE,TRANSLATIONAL GENOMICS RESEARCH INSTITUTE
"TREATMENT RESEARCH INSTITUTE, INC. (TRI)",TREATMENT RESEARCH INSTITUTE,TREATMENT RESEARCH INSTITUTE
TRINITY COLLEGE (CONNECTICUT),TRINITY COLLEGE - CONNECTICUT,TRINITY COLLEGE - CONNECTICUT
TRINITY UNIVERSITY OF SAN ANTONIO,TRINITY UNIVERSITY OF SAN ANTONIO,TRINITY UNIVERSITY OF SAN ANTONIO
TRUDEAU INSTITUTE INC,"TRUDEAU INSTITUTE, INC.","TRUDEAU INSTITUTE, INC."
TUFTS UNIVERSITY - MEDFORD,TUFTS UNIVERSITY - MEDFORD,TUFTS UNIVERSITY
TUFTS-NEW ENGLAND MEDICAL CENTER,NEW ENGLAND MEDICAL CENTER,NEW ENGLAND MEDICAL CENTER
TUFTS-NEW ENGLAND MEDICAL CENTER,TUFTS-NEW ENGLAND MEDICAL CENTER,TUFTS UNIVERSITY
TULANE UNIVERSITY OF LOUISIANA,TULANE UNIVERSITY,TULANE UNIVERSITY
TUSKEGEE UNIVERSITY,TUSKEGEE UNIVERSITY,TUSKEGEE UNIVERSITY
U.S. UNIFORMED SERVICES UNIVERSITY OF HEALTH SCIENCES,,RELEVANT INSTITUTION NOT IN AGREEMENTS
UMDNJ - ROBERT WOOD JOHNSON MEDICAL SCHOOL,UNIVERSITY OF MEDICINE AND DENTISTRY OF NEW JERSEY,UNIVERSITY OF MEDICINE AND DENTISTRY OF NEW JERSEY
UMPC MAGEE-WOMENS HOSPITAL,MAGEE-WOMENS HEALTH CORPORATION,MAGEE-WOMENS HEALTH CORPORATION
UNION COLLEGE,UNION COLLEGE,UNION COLLEGE
UNIVERSITIES ASSOCIATED FOR RESEARCH AND EDUCATION IN PATHOLOGY,,RELEVANT INSTITUTION NOT IN AGREEMENTS
UNIVERSITY CITY SCIENCE CENTER,UNIVERSITY CITY SCIENCE CENTER,UNIVERSITY CITY SCIENCE CENTER
UNIVERSITY HOSPITALS OF CLEVELAND,UNIVERSITY HOSPITALS OF CLEVELAND,CASE WESTERN RESERVE UNIVERSITY
UNIVERSITY OF AKRON,UNIVERSITY OF AKRON,UNIVERSITY OF AKRON
UNIVERSITY OF ALABAMA AT BIRMINGHAM,UNIVERSITY OF ALABAMA AT BIRMINGHAM,UNIVERSITY OF ALABAMA AT BIRMINGHAM
UNIVERSITY OF ALABAMA AT HUNTSVILLE,UNIVERSITY OF ALABAMA AT HUNTSVILLE,UNIVERSITY OF ALABAMA AT HUNTSVILLE
UNIVERSITY OF ALABAMA AT TUSCALOOSA,UNIVERSITY OF ALABAMA,UNIVERSITY OF ALABAMA
UNIVERSITY OF ALABAMA AT TUSCALOOSA,UNIVERSITY OF ALABAMA AT TUSCALOOSA,UNIVERSITY OF ALABAMA AT TUSCALOOSA
UNIVERSITY OF ALASKA AT ANCHORAGE,UNIVERSITY OF ALASKA AT ANCHORAGE,UNIVERSITY OF ALASKA
UNIVERSITY OF ALASKA AT FAIRBANKS,UNIVERSITY OF ALASKA AT FAIRBANKS,UNIVERSITY OF ALASKA
UNIVERSITY OF ARIZONA,UNIVERSITY OF ARIZONA,UNIVERSITY OF ARIZONA
UNIVERSITY OF ARKANSAS AT FAYETTEVILLE,UNIVERSITY OF ARKANSAS,UNIVERSITY OF ARKANSAS
UNIVERSITY OF ARKANSAS MEDICAL SCIENCES AT LITTLE ROCK,UNIVERSITY OF ARKANSAS FOR MEDICAL SCIENCES,UNIVERSITY OF ARKANSAS FOR MEDICAL SCIENCES
UNIVERSITY OF CALIFORNIA AT BERKELEY,UNIVERSITY OF CALIFORNIA AT BERKELEY,UNIVERSITY OF CALIFORNIA AT BERKELEY
UNIVERSITY OF CALIFORNIA AT DAVIS,UNIVERSITY OF CALIFORNIA AT DAVIS,UNIVERSITY OF CALIFORNIA AT DAVIS
UNIVERSITY OF CALIFORNIA AT IRVINE,UNIVERSITY OF CALIFORNIA AT IRVINE,UNIVERSITY OF CALIFORNIA AT IRVINE
UNIVERSITY OF CALIFORNIA AT LOS ANGELES,UNIVERSITY OF CALIFORNIA AT LOS ANGELES,UNIVERSITY OF CALIFORNIA AT LOS ANGELES
UNIVERSITY OF CALIFORNIA AT RIVERSIDE,UNIVERSITY OF CALIFORNIA AT RIVERSIDE,UNIVERSITY OF CALIFORNIA AT RIVERSIDE
UNIVERSITY OF CALIFORNIA AT SAN DIEGO,UNIVERSITY OF CALIFORNIA AT SAN DIEGO,UNIVERSITY OF CALIFORNIA AT SAN DIEGO
UNIVERSITY OF CALIFORNIA AT SAN FRANCISCO,UNIVERSITY OF CALIFORNIA AT SAN FRANCISCO,UNIVERSITY OF CALIFORNIA AT SAN FRANCISCO
UNIVERSITY OF CALIFORNIA AT SANTA BARBARA,UNIVERSITY OF CALIFORNIA AT SANTA BARBARA,UNIVERSITY OF CALIFORNIA AT SANTA BARBARA
UNIVERSITY OF CALIFORNIA AT SANTA BARBARA,UNIVERSITY OF CALIFORNIA AT SANTA CLARA,UNIVERSITY OF CALIFORNIA AT SANTA CLARA
UNIVERSITY OF CALIFORNIA AT SANTA CRUZ,UNIVERSITY OF CALIFORNIA AT SANTA CRUZ,UNIVERSITY OF CALIFORNIA AT SANTA CRUZ
UNIVERSITY OF CENTRAL FLORIDA,UNIVERSITY OF CENTRAL FLORIDA,UNIVERSITY OF CENTRAL FLORIDA
UNIVERSITY OF CHICAGO,UNIVERSITY OF CHICAGO,UNIVERSITY OF CHICAGO
UNIVERSITY OF CINCINNATI,UNIVERSITY OF CINCINNATI,UNIVERSITY OF CINCINNATI
UNIVERSITY OF COLORADO AT BOULDER,UNIVERSITY OF COLORADO AT BOULDER,UNIVERSITY OF COLORADO AT BOULDER
UNIVERSITY OF COLORADO AT COLORADO SPRINGS,UNIVERSITY OF COLORADO AT COLORADO SPRINGS,UNIVERSITY OF COLORADO AT COLORADO SPRINGS
UNIVERSITY OF COLORADO DENVER HEALTH SCIENCES CENTER,UNIVERSITY OF COLORADO AT DENVER,UNIVERSITY OF COLORADO AT DENVER
UNIVERSITY OF COLORADO DENVER HEALTH SCIENCES CENTER,UNIVERSITY OF COLORADO HEALTH SCIENCES CENTER,UNIVERSITY OF COLORADO HEALTH SCIENCES CENTER
UNIVERSITY OF CONNECTICUT AT STORRS,UNIVERSITY OF CONNECTICUT,UNIVERSITY OF CONNECTICUT
UNIVERSITY OF CONNECTICUT SCHOOL OF MEDICINE AND DENTISTRY,UNIVERSITY OF CONNECTICUT HEALTH CENTER,UNIVERSITY OF CONNECTICUT HEALTH CENTER
UNIVERSITY OF CONNECTICUT SCHOOL OF MEDICINE AND DENTISTRY,UNIVERSITY OF CONNECTICUT SCIENCE HEALTH CENTER,UNIVERSITY OF CONNECTICUT SCIENCE HEALTH CENTER
UNIVERSITY OF DAYTON,UNIVERSITY OF DAYTON,UNIVERSITY OF DAYTON
UNIVERSITY OF DELAWARE,UNIVERSITY OF DELAWARE,UNIVERSITY OF DELAWARE
UNIVERSITY OF DENVER,UNIVERSITY OF DENVER,UNIVERSITY OF DENVER
UNIVERSITY OF DETROIT MERCY,UNIVERSITY OF DETROIT MERCY,UNIVERSITY OF DETROIT MERCY
UNIVERSITY OF FLORIDA,UNIVERSITY OF FLORIDA,UNIVERSITY OF FLORIDA
UNIVERSITY OF GEORGIA,"UNIVERSITY OF GEORGIA RESEARCH FOUNDATION, INC.","UNIVERSITY OF GEORGIA RESEARCH FOUNDATION, INC."
UNIVERSITY OF HARTFORD,UNIVERSITY OF HARTFORD,UNIVERSITY OF HARTFORD
UNIVERSITY OF HAWAII,UNIVERSITY OF HAWAII,UNIVERSITY OF HAWAII
UNIVERSITY OF HOUSTON,UNIVERSITY OF HOUSTON,UNIVERSITY OF HOUSTON
UNIVERSITY OF IDAHO,UNIVERSITY OF IDAHO,UNIVERSITY OF IDAHO
UNIVERSITY OF ILLINOIS AT CHICAGO,THE UNIVERSITY OF ILLINOIS AT CHICAGO,THE UNIVERSITY OF ILLINOIS AT CHICAGO
UNIVERSITY OF ILLINOIS AT CHICAGO,UNIVERSITY OF ILLINOIS AT CHICAGO,UNIVERSITY OF ILLINOIS AT CHICAGO
UNIVERSITY OF ILLINOIS AT URBANA-CHAMPAIGN,UNIVERSITY OF ILLINOIS AT URBANA CHAMPAIGN,UNIVERSITY OF ILLINOIS AT URBANA CHAMPAIGN
UNIVERSITY OF ILLINOIS AT URBANA-CHAMPAIGN,UNIVERSITY OF ILLINOIS AT URBANA-CHAMPAIGN,UNIVERSITY OF ILLINOIS AT URBANA-CHAMPAIGN
UNIVERSITY OF IOWA,UNIVERSITY OF IOWA,UNIVERSITY OF IOWA
UNIVERSITY OF KANSAS AT LAWRENCE,UNIVERSITY OF KANSAS,UNIVERSITY OF KANSAS
UNIVERSITY OF KANSAS MEDICAL CENTER,UNIVERSITY OF KANSAS MEDICAL CENTER,UNIVERSITY OF KANSAS MEDICAL CENTER
UNIVERSITY OF KENTUCKY,UNIVERSITY OF KENTUCKY,UNIVERSITY OF KENTUCKY
UNIVERSITY OF LOUISIANA AT MONROE,UNIVERSITY OF LOUISIANA AT MONROE,UNIVERSITY OF LOUISIANA AT MONROE
UNIVERSITY OF LOUISVILLE,UNIVERSITY OF LOUISVILLE,UNIVERSITY OF LOUISVILLE
UNIVERSITY OF MAINE,UNIVERSITY OF MAINE SYSTEM,UNIVERSITY OF MAINE SYSTEM
UNIVERSITY OF MARYLAND AT BALTIMORE,UNIVERSITY OF MARYLAND AT BALTIMORE,UNIVERSITY OF MARYLAND AT BALTIMORE
UNIVERSITY OF MARYLAND AT BALTIMORE COUNTY,UNIVERSITY OF MARYLAND AT BALTIMORE COUNTY,UNIVERSITY OF MARYLAND AT BALTIMORE COUNTY
UNIVERSITY OF MARYLAND AT BALTIMORE COUNTY,UNIVERSITY OF MARYLAND BALTIMORE COUNTY,UNIVERSITY OF MARYLAND BALTIMORE COUNTY
UNIVERSITY OF MARYLAND AT COLLEGE PARK,UNIVERSITY OF MARYLAND,UNIVERSITY OF MARYLAND
UNIVERSITY OF MARYLAND AT COLLEGE PARK,UNIVERSITY OF MARYLAND AT COLLEGE PARK,UNIVERSITY OF MARYLAND AT COLLEGE PARK
UNIVERSITY OF MARYLAND BIOTECHNOLOGY INSTITUTE,,RELEVANT INSTITUTION NOT IN AGREEMENTS
UNIVERSITY OF MASSACHUSETTS AT AMHERST,UNIVERSITY OF MASSACHUSETTS AT AMHERST,UNIVERSITY OF MASSACHUSETTS AT AMHERST
UNIVERSITY OF MASSACHUSETTS AT BOSTON,UNIVERSITY OF MASSACHUSETTS AT BOSTON,UNIVERSITY OF MASSACHUSETTS AT BOSTON
UNIVERSITY OF MASSACHUSETTS AT DARTMOUTH,UNIVERSITY OF MASSACHUSETTS AT DARTMOUTH,UNIVERSITY OF MASSACHUSETTS AT DARTMOUTH
UNIVERSITY OF MASSACHUSETTS AT LOWELL,UNIVERSITY OF MASSACHUSETTS LOWELL CAMPUS,UNIVERSITY OF MASSACHUSETTS LOWELL CAMPUS
UNIVERSITY OF MASSACHUSETTS MEDICAL SCHOOL AT WORCESTER,UNIVERSITY OF MASSACHUSETTS MEDICAL SCHOOL,UNIVERSITY OF MASSACHUSETTS MEDICAL SCHOOL
UNIVERSITY OF MEDICINE AND DENTISTRY OF NEW JERSEY,UNIVERSITY OF MEDICINE AND DENTISTRY OF NEW JERSEY,UNIVERSITY OF MEDICINE AND DENTISTRY OF NEW JERSEY
UNIVERSITY OF MEMPHIS,THE UNIVERSITY OF MEMPHIS,THE UNIVERSITY OF MEMPHIS
UNIVERSITY OF MEMPHIS,UNIVERSITY OF MEMPHIS,UNIVERSITY OF MEMPHIS
UNIVERSITY OF MIAMI AT CORAL GABLES,UNIVERSITY OF MIAMI,UNIVERSITY OF MIAMI
UNIVERSITY OF MIAMI SCHOOL OF MEDICINE,UNIVERSITY OF MIAMI SCHOOL OF MEDICINE,UNIVERSITY OF MIAMI
UNIVERSITY OF MICHIGAN,UNIVERSITY OF MICHIGAN,UNIVERSITY OF MICHIGAN
UNIVERSITY OF MINNESOTA AT DULUTH,UNIVERSITY OF MINNESOTA AT DULUTH,UNIVERSITY OF MINNESOTA AT DULUTH
UNIVERSITY OF MINNESOTA AT TWIN CITIES,UNIVERSITY OF MINNESOTA AT TWIN CITIES,UNIVERSITY OF MINNESOTA AT TWIN CITIES
UNIVERSITY OF MISSISSIPPI,UNIVERSITY OF MISSISSIPPI,UNIVERSITY OF MISSISSIPPI
UNIVERSITY OF MISSISSIPPI MEDICAL CENTER,UNIVERSITY OF MISSISSIPPI MEDICAL CENTER,UNIVERSITY OF MISSISSIPPI MEDICAL CENTER
UNIVERSITY OF MISSOURI AT COLUMBIA,UNIVERSITY OF MISSOURI AT COLUMBIA,UNIVERSITY OF MISSOURI AT COLUMBIA
UNIVERSITY OF MISSOURI AT KANSAS CITY,UNIVERSITY OF MISSOURI AT KANSAS CITY,UNIVERSITY OF MISSOURI AT KANSAS CITY
UNIVERSITY OF MISSOURI AT ROLLA,UNIVERSITY OF MISSOURI AT ROLLA,UNIVERSITY OF MISSOURI AT ROLLA
UNIVERSITY OF MISSOURI AT ST. LOUIS,UNIVERSITY OF MISSOURI AT ST. LOUIS,UNIVERSITY OF MISSOURI AT ST. LOUIS
UNIVERSITY OF MONTANA,UNIVERSITY OF MONTANA,UNIVERSITY OF MONTANA
UNIVERSITY OF NEBRASKA AT LINCOLN,UNIVERSITY OF NEBRASKA AT LINCOLN,UNIVERSITY OF NEBRASKA AT LINCOLN
UNIVERSITY OF NEBRASKA AT OMAHA,UNIVERSITY OF NEBRASKA AT OMAHA,UNIVERSITY OF NEBRASKA AT OMAHA
UNIVERSITY OF NEBRASKA MEDICAL CENTER,UNIVERSITY OF NEBRASKA MEDICAL CENTER,UNIVERSITY OF NEBRASKA MEDICAL CENTER
UNIVERSITY OF NEVADA AT LAS VEGAS,UNIVERSITY OF NEVADA AT LAS VEGAS,UNIVERSITY OF NEVADA AT LAS VEGAS
UNIVERSITY OF NEVADA AT RENO,UNIVERSITY OF NEVADA AT RENO,UNIVERSITY OF NEVADA AT RENO
UNIVERSITY OF NEW HAMPSHIRE,UNIVERSITY OF NEW HAMPSHIRE,UNIVERSITY OF NEW HAMPSHIRE
UNIVERSITY OF NEW MEXICO AT ALBUQUERQUE,UNIVERSITY OF NEW MEXICO,UNIVERSITY OF NEW MEXICO
UNIVERSITY OF NEW ORLEANS,UNIVERSITY OF NEW ORLEANS,UNIVERSITY OF NEW ORLEANS
UNIVERSITY OF NORTH CAROLINA AT CHAPEL HILL,UNIVERSITY OF NORTH CAROLINA AT CHAPEL HILL,UNIVERSITY OF NORTH CAROLINA AT CHAPEL HILL
UNIVERSITY OF NORTH CAROLINA AT CHARLOTTE,UNIVERSITY OF NORTH CAROLINA AT CHARLOTTE,UNIVERSITY OF NORTH CAROLINA AT CHARLOTTE
UNIVERSITY OF NORTH CAROLINA AT GREENSBORO,UNIVERSITY OF NORTH CAROLINA AT GREENSBORO,UNIVERSITY OF NORTH CAROLINA AT GREENSBORO
UNIVERSITY OF NORTH CAROLINA AT WILMINGTON,UNIVERSITY OF NORTH CAROLINA AT WILMINGTON,UNIVERSITY OF NORTH CAROLINA AT WILMINGTON
UNIVERSITY OF NORTH DAKOTA,UNIVERSITY OF NORTH DAKOTA,UNIVERSITY OF NORTH DAKOTA
UNIVERSITY OF NORTH FLORIDA,UNIVERSITY OF NORTH FLORDIA,UNIVERSITY OF NORTH FLORDIA
UNIVERSITY OF NORTH FLORIDA,UNIVERSITY OF NORTH FLORIDA,UNIVERSITY OF NORTH FLORIDA
UNIVERSITY OF NORTH TEXAS,UNIVERSITY OF NORTH TEXAS,UNIVERSITY OF NORTH TEXAS
UNIVERSITY OF NORTH TEXAS HEALTH SCIENCE CENTER,TEXAS COLLEGE OF OSTEOPATHIC MEDICINE,TEXAS COLLEGE OF OSTEOPATHIC MEDICINE
UNIVERSITY OF NOTRE DAME DU LAC,UNIVERSITY OF NOTRE DAME,UNIVERSITY OF NOTRE DAME
UNIVERSITY OF NOTRE DAME DU LAC,UNIVERSITY OF NOTRE DAME DU LAC,UNIVERSITY OF NOTRE DAME DU LAC
UNIVERSITY OF OKLAHOMA AT NORMAN,UNIVERSITY OF OKLAHOMA,UNIVERSITY OF OKLAHOMA
UNIVERSITY OF OKLAHOMA HEALTH SCIENCES CENTER,UNIVERSITY OF OKLAHOMA HEALTH SCIENCES CENTER,UNIVERSITY OF OKLAHOMA HEALTH SCIENCES CENTER
UNIVERSITY OF OREGON AT EUGENE,UNIVERSITY OF OREGON AT EUGENE,UNIVERSITY OF OREGON AT EUGENE
UNIVERSITY OF PENNSYLVANIA,UNIVERSITY OF PENNSYLVANIA,UNIVERSITY OF PENNSYLVANIA
UNIVERSITY OF PITTSBURGH AT PITTSBURGH,UNIVERSITY OF PITTSBURGH,UNIVERSITY OF PITTSBURGH
UNIVERSITY OF PUERTO RICO AT RIO PIEDRAS,UNIVERSITY OF PUERTO RICO AT RIO PIEDRAS,UNIVERSITY OF PUERTO RICO MEDICAL SCIENCES
UNIVERSITY OF PUERTO RICO AT RIO PIEDRAS,UNIVERSITY OF PUERTO RICO RIO PIEDRAS,UNIVERSITY OF PUERTO RICO
UNIVERSITY OF PUERTO RICO MEDICAL SCIENCES,UNIVERSITY OF PUERTO RICO MEDICAL SCIENCES,UNIVERSITY OF PUERTO RICO
UNIVERSITY OF PUERTO RICO MEDICAL SCIENCES,UNIVERSITY OF PUERTO RICO MEDICAL SCIENCES,UNIVERSITY OF PUERTO RICO MEDICAL SCIENCES
UNIVERSITY OF RHODE ISLAND,UNIVERSITY OF RHODE ISLAND,UNIVERSITY OF RHODE ISLAND
UNIVERSITY OF RICHMOND,UNIVERSITY OF RICHMOND,UNIVERSITY OF RICHMOND
UNIVERSITY OF ROCHESTER,UNIVERSITY OF ROCHESTER,UNIVERSITY OF ROCHESTER
UNIVERSITY OF SAN FRANCISCO,UNIVERSITY OF SAN FRANCISCO,UNIVERSITY OF SAN FRANCISCO
UNIVERSITY OF SOUTH ALABAMA,UNIVERSITY OF SOUTH ALABAMA,UNIVERSITY OF SOUTH ALABAMA
UNIVERSITY OF SOUTH CAROLINA AT COLUMBIA,UNIVERSITY OF SOUTH CAROLINA,UNIVERSITY OF SOUTH CAROLINA
UNIVERSITY OF SOUTH CAROLINA AT COLUMBIA,UNIVERSITY OF SOUTH CAROLINA AT COLUMBIA,UNIVERSITY OF SOUTH CAROLINA
UNIVERSITY OF SOUTH DAKOTA,UNIVERSITY OF SOUTH DAKOTA,UNIVERSITY OF SOUTH DAKOTA
UNIVERSITY OF SOUTH FLORIDA,UNIVERSITY OF SOUTH FLORIDA,UNIVERSITY OF SOUTH FLORIDA
UNIVERSITY OF SOUTHERN CALIFORNIA,UNIVERSITY OF SOUTHERN CALIFORNIA,UNIVERSITY OF SOUTHERN CALIFORNIA
UNIVERSITY OF SOUTHERN MISSISSIPPI,UNIVERSITY OF SOUTHERN MISSISSIPPI,UNIVERSITY OF SOUTHERN MISSISSIPPI
UNIVERSITY OF TENNESSEE AT CHATTANOOGA,UNIVERSITY OF TENNESSEE AT CHATTANOOGA,UNIVERSITY OF TENNESSEE AT CHATTANOOGA
UNIVERSITY OF TENNESSEE AT KNOXVILLE,UNIVERSITY OF TENNESSEE,UNIVERSITY OF TENNESSEE
UNIVERSITY OF TENNESSEE AT KNOXVILLE,UNIVERSITY OF TENNESSEE AT KNOXVILLE,UNIVERSITY OF TENNESSEE AT KNOXVILLE
UNIVERSITY OF TENNESSEE HEALTH SCIENCE CENTER,UNIVERSITY OF TENNESSEE,UNIVERSITY OF TENNESSEE
UNIVERSITY OF TENNESSEE HEALTH SCIENCE CENTER,UNIVERSITY OF TENNESSEE CENTER FOR HEALTH SCIENCES,UNIVERSITY OF TENNESSEE CENTER FOR HEALTH SCIENCES
UNIVERSITY OF TEXAS AT ARLINGTON,UNIVERSITY OF TEXAS AT ARLINGTON,UNIVERSITY OF TEXAS AT ARLINGTON
UNIVERSITY OF TEXAS AT AUSTIN,UNIVERSITY OF TEXAS AT AUSTIN,UNIVERSITY OF TEXAS AT AUSTIN
UNIVERSITY OF TEXAS AT BROWNSVILLE AND TEXAS SOUTHMOST COLLEGE,UNIVERSITY OF TEXAS AT BROWNSVILLE AND TEXAS SOUTHMOST COLLEGE,UNIVERSITY OF TEXAS AT BROWNSVILLE AND TEXAS SOUTHMOST COLLEGE
UNIVERSITY OF TEXAS AT DALLAS,UNIVERSITY OF TEXAS AT DALLAS,UNIVERSITY OF TEXAS AT DALLAS
UNIVERSITY OF TEXAS AT EL PASO,UNIVERSITY OF TEXAS AT EL PASO,UNIVERSITY OF TEXAS AT EL PASO
UNIVERSITY OF TEXAS AT SAN ANTONIO,UNIVERSITY OF TEXAS AT SAN ANTONIO,UNIVERSITY OF TEXAS AT SAN ANTONIO
UNIVERSITY OF TEXAS HEALTH CENTER AT TYLER,UNIVERSITY OF TEXAS HEALTH CENTER AT TYLER,UNIVERSITY OF TEXAS HEALTH CENTER AT TYLER
UNIVERSITY OF TEXAS HEALTH SCIENCE CENTER AT HOUSTON,UNIVERSITY OF TEXAS HEALTH SCIENCE CENTER AT HOUSTON,UNIVERSITY OF TEXAS HEALTH SCIENCE CENTER AT HOUSTON
UNIVERSITY OF TEXAS MD ANDERSON CANCER CENTER,UNIVERSITY OF TEXAS M. D. ANDERSON CANCER CENTER,UNIVERSITY OF TEXAS M. D. ANDERSON CANCER CENTER
UNIVERSITY OF TEXAS MEDICAL BRANCH AT GALVESTON,UNIVERSITY OF TEXAS MEDICAL BRANCH AT GALVESTON,UNIVERSITY OF TEXAS MEDICAL BRANCH AT GALVESTON
UNIVERSITY OF TEXAS SOUTHWESTERN MEDICAL CENTER AT DALLAS,UNIVERSITY OF TEXAS SOUTHWESTERN,UNIVERSITY OF TEXAS SOUTHWESTERN
UNIVERSITY OF TEXAS SYSTEM,,RELEVANT INSTITUTION NOT IN AGREEMENTS
UNIVERSITY OF THE PACIFIC,UNIVERSITY OF THE PACIFIC,UNIVERSITY OF THE PACIFIC
UNIVERSITY OF THE SCIENCES IN PHILADELPHIA,UNIVERSITY OF THE SCIENCES IN PHILADELPHIA,UNIVERSITY OF THE SCIENCES IN PHILADELPHIA
UNIVERSITY OF TOLEDO,UNIVERSITY OF TOLEDO,UNIVERSITY OF TOLEDO
UNIVERSITY OF TOLEDO HEALTH SCIENCES CENTER,MEDICAL COLLEGE OF OHIO AT TOLEDO,MEDICAL COLLEGE OF OHIO AT TOLEDO
UNIVERSITY OF TULSA,UNIVERSITY OF TULSA,UNIVERSITY OF TULSA
UNIVERSITY OF UTAH,UNIVERSITY OF UTAH,UNIVERSITY OF UTAH
UNIVERSITY OF VERMONT AND STATE AGRICULTURAL COLLEGE,UNIVERSITY OF VERMONT,UNIVERSITY OF VERMONT
UNIVERSITY OF VIRGINIA AT CHARLOTTESVILLE,UNIVERSITY OF VIRGINIA,UNIVERSITY OF VIRGINIA
UNIVERSITY OF WASHINGTON,UNIVERSITY OF WASHINGTON,UNIVERSITY OF WASHINGTON
UNIVERSITY OF WISCONSIN AT EAU CLAIRE,UNIVERSITY OF WISCONSIN SYSTEM - EAU CLAIRE,UNIVERSITY OF WISCONSIN SYSTEM - EAU CLAIRE
UNIVERSITY OF WISCONSIN AT GREEN BAY,UNIVERSITY OF WISCONSIN SYSTEM - GREEN BAY,UNIVERSITY OF WISCONSIN SYSTEM - GREEN BAY
UNIVERSITY OF WISCONSIN AT MADISON,UNIVERSITY OF WISCONSIN - EXTENSION,UNIVERSITY OF WISCONSIN - EXTENSION
UNIVERSITY OF WISCONSIN AT MADISON,UNIVERSITY OF WISCONSIN - MADISON AND EXTENSION,UNIVERSITY OF WISCONSIN - MADISON AND EXTENSION
UNIVERSITY OF WISCONSIN AT MILWAUKEE,UNIVERSITY OF WISCONSIN - MILWAUKEE,UNIVERSITY OF WISCONSIN - MILWAUKEE
UNIVERSITY OF WISCONSIN AT PARKSIDE,UNIVERSITY OF WISCONSIN SYSTEM - PARKSIDE,UNIVERSITY OF WISCONSIN SYSTEM - PARKSIDE
UNIVERSITY OF WISCONSIN AT RIVER FALLS,UNIVERSITY OF WISCONSIN SYSTEM - RIVER FALLS,UNIVERSITY OF WISCONSIN SYSTEM - RIVER FALLS
UNIVERSITY OF WISCONSIN AT WHITEWATER,UNIVERSITY OF WISCONSIN SYSTEM - WHITEWATER,UNIVERSITY OF WISCONSIN SYSTEM - WHITEWATER
UNIVERSITY OF WYOMING,UNIVERSITY OF WYOMING,UNIVERSITY OF WYOMING
UNIVERSITYERSIDAD CENTRAL DEL CARIBE,UNIVERSIDAD CENTRAL DEL CARIBE,UNIVERSIDAD CENTRAL DEL CARIBE
UPMC CHILDRENS HOSPITAL OF PITTSBURGH,CHILDREN'S HOSPITAL OF PITTSBURGH,CHILDREN'S HOSPITAL OF PITTSBURGH
URBAN INSTITUTE,,RELEVANT INSTITUTION NOT IN AGREEMENTS
UTAH STATE UNIVERSITY,UTAH STATE UNIVERSITY,UTAH STATE UNIVERSITY
VAN ANDEL RESEARCH INSTITUTE,VAN ANDEL RESEARCH INSTITUTE,VAN ANDEL RESEARCH INSTITUTE
VANDERBILT UNIVERSITY,VANDERBILT UNIVERSITY,VANDERBILT UNIVERSITY
VASSAR COLLEGE,VASSAR COLLEGE,VASSAR COLLEGE
VETERANS MEDICAL RESEARCH FOUNDATION OF SAN DIEGO,VETERANS MEDICAL RESEARCH FOUNDATION,VETERANS MEDICAL RESEARCH FOUNDATION
VILLANOVA UNIVERSITY,VILLANOVA UNIVERSITY,VILLANOVA UNIVERSITY
VIRGINIA COMMONWEALTH UNIVERSITY,VIRGINIA COMMONWEALTH UNIVERSITY,VIRGINIA COMMONWEALTH UNIVERSITY
VIRGINIA POLYTECHNIC INSTITUTE AND STATE UNIVERSITY,VIRGINIA POLYTECHNIC INSTITUTE,VIRGINIA POLYTECHNIC INSTITUTE
VIRGINIA POLYTECHNIC INSTITUTE AND STATE UNIVERSITY,VIRGINIA TECH,VIRGINIA TECH
WADSWORTH CENTER,WADSWORTH CENTER FOR LABORATORIES AND RESEARCH,"HEALTH RESEARCH, INC."
WAKE FOREST UNIVERSITY HEALTH SCIENCES,WAKE FOREST UNIVERSITY HEALTH SCIENCES,WAKE FOREST UNIVERSITY HEALTH SCIENCES
WASHINGTON HOSPITAL CENTER,,RELEVANT INSTITUTION NOT IN AGREEMENTS
WASHINGTON STATE UNIVERSITY,WASHINGTON STATE UNIVERSITY,WASHINGTON STATE UNIVERSITY
WASHINGTON UNIVERSITY,WASHINGTON UNIVERSITY,WASHINGTON UNIVERSITY
WAYNE STATE UNIVERSITY,WAYNE STATE UNIVERSITY,WAYNE STATE UNIVERSITY
WEILL MEDICAL COLLEGE OF CORNELL UNIVERSITY,WEILL MEDICAL COLLEGE OF CORNELL UNIVERSITY,WEILL MEDICAL COLLEGE OF CORNELL UNIVERSITY
WELLESLEY COLLEGE,WELLESLEY COLLEGE,WELLESLEY COLLEGE
WESLEYAN UNIVERSITY,WESLEYAN UNIVERSITY,WESLEYAN UNIVERSITY
WEST VIRGINIA UNIVERSITY,WEST VIRGINIA UNIVERSITY,WEST VIRGINIA UNIVERSITY
"WESTAT, INC.",,RELEVANT INSTITUTION NOT IN AGREEMENTS
WESTERN CAROLINA UNIVERSITY,WESTERN CAROLINA UNIVERSITY,WESTERN CAROLINA UNIVERSITY
WESTERN CONSORTIUM FOR PUBLIC HEALTH,,RELEVANT INSTITUTION NOT IN AGREEMENTS
WESTERN KENTUCKY UNIVERSITY,WESTERN KENTUCKY UNIVERSITY,WESTERN KENTUCKY UNIVERSITY
WESTERN MICHIGAN UNIVERSITY,WESTERN MICHIGAN UNIVERSITY,WESTERN MICHIGAN UNIVERSITY
WESTERN PENNSYLVANIA HOSPITAL,THE WESTERN PENNSYLVANIA HOSPITAL FOUNDATION,THE WESTERN PENNSYLVANIA HOSPITAL FOUNDATION
WESTERN WASHINGTON UNIVERSITY,WESTERN WASHINGTON UNIVERSITY,WESTERN WASHINGTON UNIVERSITY
WHITEHEAD INSTITUTE FOR BIOMEDICAL RESEARCH,WHITEHEAD INSTITUTE FOR BIOMEDICAL RESEARCH,WHITEHEAD INSTITUTE FOR BIOMEDICAL RESEARCH
WHITTIER INSTITUTE FOR DIABETES AND ENDOCRINOLOGY,,RELEVANT INSTITUTION NOT IN AGREEMENTS
WICHITA STATE UNIVERSITY,WICHITA STATE UNIVERSITY,WICHITA STATE UNIVERSITY
WILLIAM BEAUMONT HOSPITAL,WILLIAM BEAUMONT HOSPITAL,WILLIAM BEAUMONT HOSPITAL
WILLIAMS COLLEGE,WILLIAMS COLLEGE,WILLIAMS COLLEGE
WILLIAMS COLLEGE,WILLLIAMS COLLEGE,WILLLIAMS COLLEGE
WILLS EYE HOSPITAL (PHILADELPHIA),WILLS EYE HOSPITAL,WILLS EYE HOSPITAL
WINSTON-SALEM STATE UNIVERSITY,WINSTON-SALEM STATE UNIVERSITY,WINSTON-SALEM STATE UNIVERSITY
WINSTON-SALEM STATE UNIVERSITY,WINSTON-SALEM UNIVERSITY,WINSTON-SALEM UNIVERSITY
WINTHROP-UNIVERSITY HOSPITAL,WINTHROP UNIVERSITY HOSPITAL,WINTHROP UNIVERSITY HOSPITAL
WISTAR INSTITUTE,THE WISTAR INSTITUTE OF ANATOMY AND BIOLOGY,THE WISTAR INSTITUTE OF ANATOMY AND BIOLOGY
WOMEN AND INFANTS HOSPITAL-RHODE ISLAND,WOMEN AND INFANTS' HOSPITAL,WOMEN AND INFANTS' HOSPITAL
WOODS HOLE OCEANOGRAPHIC INSTITUTE,WOODS HOLE OCEANOGRAPHIC INSTITUTION,WOODS HOLE OCEANOGRAPHIC INSTITUTION
WORCESTER FOUNDATION FOR BIOMEDICAL RESEARCH,,RELEVANT INSTITUTION NOT IN AGREEMENTS
WORCESTER POLYTECHNIC INSTITUTE,WORCESTER POLYTECHNIC INSTITUTE,WORCESTER POLYTECHNIC INSTITUTE
WRIGHT INSTITUTE,,RELEVANT INSTITUTION NOT IN AGREEMENTS
WRIGHT STATE UNIVERSITY,WRIGHT STATE UNIVERSITY,WRIGHT STATE UNIVERSITY
YALE UNIVERSITY,YALE UNIVERSITY,YALE UNIVERSITY
YALE-NEW HAVEN HOSPITAL,YALE NEW HAVEN HEALTH,YALE NEW HAVEN HEALTH
YESHIVA UNIVERSITY,YESHIVA UNIVERSITY,YESHIVA UNIVERSITY
