final_institution,post_subinstitution,original_institution
LOUISIANA STATE UNIVERSITY HEALTH SCIENCES CENTER AT NEW ORLEANS,LOUISIANA STATE UNIVERSITY HEALTH SCIENCES CENTER AT NEW ORLEANS,LOUISIANA STATE UNIVERSITY HEALTH SCIENCES CENTER AT NEW ORLEANS
LOUISIANA STATE UNIVERSITY HEALTH SCIENCES CENTER AT NEW ORLEANS,LOUISIANA STATE UNIVERSITY MEDICAL CENTER,LOUISIANA STATE UNIVERSITY MEDICAL CENTER
LOUISIANA STATE UNIVERSITY HEALTH SCIENCES CENTER AT SHREVEPORT,LOUISIANA STATE UNIVERSITY HEALTH SCIENCES CENTER AT SHREVEPORT,LOUISIANA STATE UNIVERSITY HEALTH SCIENCES CENTER AT SHREVEPORT
LOUISIANA STATE UNIVERSITY PENNINGTON BIOMEDICAL RESEARCH CENTER,,RELEVANT INSTITUTION NOT IN AGREEMENTS
LOUISIANA TECH UNIVERSITY,LOUISIANA TECH UNIVERSITY,LOUISIANA TECH UNIVERSITY
LOVELACE BIOMEDICAL AND ENVIRONMENTAL RESEARCH,,RELEVANT INSTITUTION NOT IN AGREEMENTS
LOVELACE RESPIRATORY RESEARCH INSTITUTE,,RELEVANT INSTITUTION NOT IN AGREEMENTS
LOYOLA UNIVERSITY IN NEW ORLEANS,LOYOLA UNIVERSITY,LOYOLA UNIVERSITY
LOYOLA UNIVERSITY MEDICAL CENTER,LOYOLA UNIVERSITY OF CHICAGO,LOYOLA UNIVERSITY OF CHICAGO
LUCILE SALTER PACKARD CHILDRENS HOSPITAL AT STANFORD,,RELEVANT INSTITUTION NOT IN AGREEMENTS
LUDWIG INSTITUTE FOR CANCER RESEARCH,LUDWIG INSTITUTE FOR CANCER RESEARCH,LUDWIG INSTITUTE FOR CANCER RESEARCH
MACALESTER COLLEGE,MACALESTER COLLEGE,MACALESTER COLLEGE
MADLYN AND LEONARD ABRAMSON CENTER FOR JEWISH LIFE,MADLYN AND LEONARD ABRAMSON CENTER FOR JEWISH LIFE,MADLYN AND LEONARD ABRAMSON CENTER FOR JEWISH LIFE
MAGEE-WOMENS HEALTH CORPORATION,,RELEVANT INSTITUTION NOT IN AGREEMENTS
MAHARISHI UNIVERSITY OF MANAGEMENT,MAHARISHI UNIVERSITY OF MANAGEMENT,MAHARISHI UNIVERSITY OF MANAGEMENT
MAIMONIDES MEDICAL CENTER,MAIMONIDES MEDICAL CENTER,MAIMONIDES MEDICAL CENTER
MAINE MEDICAL CENTER,MAINE MEDICAL CENTER,MAINE MEDICAL CENTER
MALLORY INSTITUTE OF PATHOLOGY,,RELEVANT INSTITUTION NOT IN AGREEMENTS
MANHATTAN COLLEGE,MANHATTAN COLLEGE,MANHATTAN COLLEGE
MARINE BIOLOGICAL LABORATORY,MARINE BIOLOGICAL LABORATORY,MARINE BIOLOGICAL LABORATORY
MARQUETTE UNIVERSITY,MARQUETTE UNIVERSITY,MARQUETTE UNIVERSITY
MARSHALL UNIVERSITY,MARSHALL UNIVERSITY,MARSHALL UNIVERSITY
MARSHFIELD CLINIC RESEARCH FOUNDATION,MARSHFIELD CLINIC RESEARCH FOUNDATION,MARSHFIELD CLINIC RESEARCH FOUNDATION
MARY IMOGENE BASSETT HOSPITAL,BASSETT HEALTHCARE,BASSETT HEALTHCARE
"MARYLAND MEDICAL RESEARCH INSTITUTE, INC","MARYLAND MEDICAL RESEARCH INSTITUTE, INC.","MARYLAND MEDICAL RESEARCH INSTITUTE, INC."
MASONIC MEDICAL RESEARCH LABORATORY,MASONIC MEDICAL RESEARCH LABORATORY,MASONIC MEDICAL RESEARCH LABORATORY
MASSACHUSETTS COLLEGE OF PHARMACY AND HEALTH SCIENCES,MASS COLLEGE OF PHARMACY AND ALLIED HEALTH SERVICE,MASS COLLEGE OF PHARMACY AND ALLIED HEALTH SERVICE
MASSACHUSETTS COLLEGE OF PHARMACY AND HEALTH SCIENCES,MASSACHUSETTS COLLEGE OF PHARMACY AND HEALTH SCIENCES,MASSACHUSETTS COLLEGE OF PHARMACY AND HEALTH SCIENCES
MASSACHUSETTS EYE AND EAR INFIRMARY,MASSACHUSETTS EYE AND EAR INFIRMARY,MASSACHUSETTS EYE AND EAR INFIRMARY
MASSACHUSETTS GENERAL HOSPITAL,MASSACHUSETTS GENERAL HOSPITAL,MASSACHUSETTS GENERAL HOSPITAL
MASSACHUSETTS INSTITUTE OF TECHNOLOGY,MASSACHUSETTS INSTITUTE OF TECHNOLOGY,MASSACHUSETTS INSTITUTE OF TECHNOLOGY
MASSACHUSETTS INSTITUTE OF TECHNOLOGY,MASSACHUSETTS INSTITUTE OF TECHNOLOGY (CORRECTED COPY),MASSACHUSETTS INSTITUTE OF TECHNOLOGY (CORRECTED COPY)
MASSACHUSETTS INSTITUTE OF TECHNOLOGY,MASSACHUSETTSETTS INSTITUTE OF TECHNOLOGY,MASSACHUSETTSETTS INSTITUTE OF TECHNOLOGY
MASSACHUSETTS MENTAL HEALTH CENTER,MASSACHUSETTS MENTAL HEALTH RESEARCH CORPORATION,MASSACHUSETTS MENTAL HEALTH RESEARCH CORPORATION
MAYO CLINIC COLLEGE OF MEDICINE,MAYO CLINIC ROCHESTER,MAYO CLINIC ROCHESTER
MAYO CLINIC COLLEGE OF MEDICINE (ARIZONA),MAYO CLINIC ARIZONA,MAYO CLINIC ARIZONA
MAYO CLINIC COLLEGE OF MEDICINE (FLORIDA),MAYO CLINIC JACKSONVILLE,MAYO CLINIC JACKSONVILLE
MCLAUGHLIN RESEARCH INSTITUTE,MCLAUGHLIN RESEARCH INSTITUTE,MCLAUGHLIN RESEARCH INSTITUTE
MCLEAN HOSPITAL,MCLEAN HOSPITAL,MCLEAN HOSPITAL
MEDICAL BIOLOGY INSTITUTE,,RELEVANT INSTITUTION NOT IN AGREEMENTS
MEDICAL COLLEGE OF GEORGIA,MEDICAL COLLEGE OF GEORGIA,MEDICAL COLLEGE OF GEORGIA
MEDICAL COLLEGE OF WISCONSIN,MEDICAL COLLEGE OF WISCONSIN,MEDICAL COLLEGE OF WISCONSIN
MEDICAL UNIVERSITY OF SOUTH CAROLINA,MEDICAL UNIVERSITY OF SOUTH CAROLINA,MEDICAL UNIVERSITY OF SOUTH CAROLINA
MEDLANTIC RESEARCH INSTITUTE,MEDSTAR RESEARCH INSTITUTE,MEDSTAR RESEARCH INSTITUTE
MEHARRY MEDICAL COLLEGE,MEHARRY MEDICAL COLLEGE,MEHARRY MEDICAL COLLEGE
MEMORIAL HOSPITAL OF RHODE ISLAND,MEMORIAL HOSPITAL OF RHODE ISLAND,MEMORIAL HOSPITAL OF RHODE ISLAND
MEMORIAL SLOAN KETTERING CANCER CENTER,SLOAN-KETTERING INSTITUTE FOR CANCER RESEARCH,SLOAN-KETTERING INSTITUTE FOR CANCER RESEARCH
MENNINGER FOUNDATION,,RELEVANT INSTITUTION NOT IN AGREEMENTS
MENORAH PARK CENTER FOR AGING,MENORAH PARK CENTER FOR AGING,MENORAH PARK CENTER FOR AGING
MERCER UNIVERSITY AT MACON,MERCER UNIVERSITY,MERCER UNIVERSITY
MERCY CATHOLIC MEDICAL CENTER,,RELEVANT INSTITUTION NOT IN AGREEMENTS
MERCY HOSPITAL AND MEDICAL CENTER (CHICAGO),,RELEVANT INSTITUTION NOT IN AGREEMENTS
METROHEALTH MEDICAL CENTER,METROHEALTH MEDICAL CENTER,CASE WESTERN RESERVE UNIVERSITY
METROHEALTH MEDICAL CENTER,METROHEALTH MEDICAL CENTER,METROHEALTH MEDICAL CENTER
MIAMI UNIVERSITY AT OXFORD,MIAMI UNIVERSITY,MIAMI UNIVERSITY
MICHAEL REESE HOSPITAL AND MEDICAL CENTER,,RELEVANT INSTITUTION NOT IN AGREEMENTS
MICHIGAN STATE UNIVERSITY,MICHIGAN STATE UNIVERSITY,MICHIGAN STATE UNIVERSITY
MICHIGAN TECHNOLOGICAL UNIVERSITY,MICHIGAN TECHNOLOGICAL UNIVERSITY,MICHIGAN TECHNOLOGICAL UNIVERSITY
MIDDLEBURY COLLEGE,MIDDLEBURY COLLEGE,MIDDLEBURY COLLEGE
MINNEAPOLIS MEDICAL RESEARCH FOUNDATION,MINNEAPOLIS MEDICAL RESEARCH FOUNDATION,MINNEAPOLIS MEDICAL RESEARCH FOUNDATION
MIRIAM HOSPITAL,THE MIRIAM,THE MIRIAM
MISSISSIPPI STATE UNIVERSITY,MISSISSIPPI STATE UNIVERSITY,MISSISSIPPI STATE UNIVERSITY
MOLECULAR RESEARCH INSTITUTE,MOLECULAR RESEARCH INSTITUTE,MOLECULAR RESEARCH INSTITUTE
MONELL CHEMICAL SENSES CENTER,MONELL CHEMICAL SENSES CENTER,MONELL CHEMICAL SENSES CENTER
MONTANA STATE UNIVERSITY AT BOZEMAN,MONTANA STATE UNIVERSITY AT BOZEMAN,MONTANA STATE UNIVERSITY AT BOZEMAN
MONTEFIORE HOSPITAL AND MEDICAL CENTER,MONTEFIORE HOSPITAL AND MEDICAL CENTER,MONTEFIORE HOSPITAL AND MEDICAL CENTER
MOREHOUSE COLLEGE,MOREHOUSE COLLEGE,MOREHOUSE COLLEGE
MOREHOUSE SCHOOL OF MEDICINE,MOREHOUSE SCHOOL OF MEDICINE,MOREHOUSE SCHOOL OF MEDICINE
MOSS REHABILITATION HOSPITAL,MOSS REHABILITATION HOSPITAL,ALBERT EINSTEIN HEALTHCARE NETWORK
MOUNT HOLYOKE COLLEGE,MOUNT HOLYOKE COLLEGE,MOUNT HOLYOKE COLLEGE
MOUNT SINAI HOSPITAL (MINNEAPOLIS),,RELEVANT INSTITUTION NOT IN AGREEMENTS
MOUNT SINAI MEDICAL CENTER (MIAMI BEACH),MOUNT SINAI MEDICAL CENTER OF GREATER MIAMI,MOUNT SINAI MEDICAL CENTER OF GREATER MIAMI
MOUNT SINAI SCHOOL OF MEDICINE,MOUNT SINAI SCHOOL OF MEDICINE,MOUNT SINAI SCHOOL OF MEDICINE
MOUNT ZION HOSPITAL AND MEDICAL CENTER,,RELEVANT INSTITUTION NOT IN AGREEMENTS
NARROWS INSTITUTE FOR BIOMEDICAL RESEARCH INC,"NARROWS INSTITUTE FOR BIOMEDICAL RESEARCH, INC.","NARROWS INSTITUTE FOR BIOMEDICAL RESEARCH, INC."
NASSAU UNIVERSITY MEDICAL CENTER,,RELEVANT INSTITUTION NOT IN AGREEMENTS
NATIONAL BIOMEDICAL RESEARCH FOUNDATION,"NATIONAL BIOMEDICAL RESEARCH FOUNDATION, INC.","NATIONAL BIOMEDICAL RESEARCH FOUNDATION, INC."
NATIONAL BUREAU OF ECONOMIC RESEARCH,,RELEVANT INSTITUTION NOT IN AGREEMENTS
NATIONAL CENTER ON ADDICTION AND SUBSTANCE ABUSE AT COLUMBIA UNIVERSITY,NATIONAL CENTER ON ADDICTION AND SUBSTANCE ABUSE AT COLUMBIA UNIVERSITY,NATIONAL CENTER ON ADDICTION AND SUBSTANCE ABUSE AT COLUMBIA UNIVERSITY
NATIONAL DEVELOPMENT AND RESEARCH INSTITUTES,"NATIONAL DEVELOPMENT AND RESEARCH INSTITUTES, INC.","NATIONAL DEVELOPMENT AND RESEARCH INSTITUTES, INC."
NATIONAL JEWISH MEDICAL AND RESEARCH CENTER,NATIONAL JEWISH MEDICAL AND RESEARCH CENTER,NATIONAL JEWISH MEDICAL AND RESEARCH CENTER
NATIONAL OPINION RESEARCH CENTER,NATIONAL OPINION RESEARCH CENTER,NATIONAL OPINION RESEARCH CENTER
NATIONAL POLYTECHNIC INSTITUTE,,RELEVANT INSTITUTION NOT IN AGREEMENTS
NAYLOR DANA INSTITUTE FOR DISEASE PREVENTION,,RELEVANT INSTITUTION NOT IN AGREEMENTS
NEMOURS FOUNDATION,NEMOURS FOUNDATION,NEMOURS FOUNDATION
NEUROPSYCHIATRIC RESEARCH INSTITUTE,NEUROPSYCHIATRIC RESEARCH INSTITUTE,NEUROPSYCHIATRIC RESEARCH INSTITUTE
NEW ENGLAND COLLEGE OF OPTOMETRY,NEW ENGLAND COLLEGE OF OPTOMETRY,NEW ENGLAND COLLEGE OF OPTOMETRY
NEW ENGLAND DEACONESS HOSPITAL,,RELEVANT INSTITUTION NOT IN AGREEMENTS
"NEW ENGLAND RESEARCH INSTITUTES, INC.",,RELEVANT INSTITUTION NOT IN AGREEMENTS
NEW JERSEY INSTITUTE OF TECHNOLOGY,NEW JERSEY INSTITUTE OF TECHNOLOGY,NEW JERSEY INSTITUTE OF TECHNOLOGY
NEW MEXICO HIGHLANDS UNIVERSITY,NEW MEXICO HIGHLANDS UNIVERSITY,NEW MEXICO HIGHLANDS UNIVERSITY
NEW MEXICO STATE UNIVERSITY AT LAS CRUCES,NEW MEXICO STATE UNIVERSITY,NEW MEXICO STATE UNIVERSITY
NEW YORK BLOOD CENTER,"NEW YORK BLOOD CENTER, INC.","NEW YORK BLOOD CENTER, INC."
NEW YORK INSTITUTE OF TECHNOLOGY,NEW YORK INSTITUTE OF TECHNOLOGY,NEW YORK INSTITUTE OF TECHNOLOGY
NEW YORK MEDICAL COLLEGE,NEW YORK MEDICAL COLLEGE,NEW YORK MEDICAL COLLEGE
NEW YORK STATE PSYCHIATRIC INSTITUTE,NEW YORK PSYCHIATRIC INSTITUTE,"RESEARCH FOUNDATION FOR MENTAL HYGIENE, INC."
NEW YORK UNIVERSITY,NEW YORK UNIVERSITY,NEW YORK UNIVERSITY
NEW YORK UNIVERSITY MEDICAL CENTER,NEW YORK UNIVERSITY MEDICAL CENTER,NEW YORK UNIVERSITY MEDICAL CENTER
NEW YORK UNIVERSITY MEDICAL CENTER,NEW YORK UNIVERSITY SCHOOL OF MEDICINE,NEW YORK UNIVERSITY MEDICAL CENTER
NEW YORK UNIVERSITY MEDICAL CENTER,NEW YORK UNIVERSITY SCHOOL OF MEDICINE,NEW YORK UNIVERSITY SCHOOL OF MEDICINE
NEW YORK UNIVERSITY TANDON SCHOOL OF ENGINEERING,POLYTECHNIC UNIVERSITY,POLYTECHNIC UNIVERSITY
NEWARK BETH ISRAEL MEDICAL CENTER,NEWARK BETH ISRAEL MEDICAL CENTER,NEWARK BETH ISRAEL MEDICAL CENTER
NORTH CAROLINA CENTRAL UNIVERSITY,NORTH CAROLINA CENTRAL UNIVERSITY,NORTH CAROLINA CENTRAL UNIVERSITY
NORTH CAROLINA STATE UNIVERSITY AT RALEIGH,NORTH CAROLINA STATE UNIVERSITY,NORTH CAROLINA STATE UNIVERSITY
"NORTH CHARLES MENTAL HEALTH RESEARCH AND TRAINING FOUNDATION, INC.","NORTH CHARLES MENTAL HEALTH RESEARCH AND TRAINING FOUNDATION, INC.","NORTH CHARLES MENTAL HEALTH RESEARCH AND TRAINING FOUNDATION, INC."
NORTH DAKOTA STATE UNIVERSITY,NORTH DAKOTA STATE UNIVERSITY,NORTH DAKOTA STATE UNIVERSITY
NORTH SHORE - LONG ISLAND JEWISH MEDICAL CENTER,NORTH SHIRE LONG ISLAND JEWISH HEALTH SYSTEM,NORTH SHIRE LONG ISLAND JEWISH HEALTH SYSTEM
NORTH SHORE - LONG ISLAND JEWISH MEDICAL CENTER,NORTH SHORE - LONG ISLAND JEWISH HEALTH SYSTEM,NORTH SHORE - LONG ISLAND JEWISH HEALTH SYSTEM
NORTH SHORE UNIVERSITY HOSPITAL,,RELEVANT INSTITUTION NOT IN AGREEMENTS
NORTHEASTERN OHIO UNIVERSITY COLLEGE OF MEDICINE,NORTHEASTERN OHIO UNIVERSITY COLLEGE OF MEDICINE,NORTHEASTERN OHIO UNIVERSITY COLLEGE OF MEDICINE
NORTHEASTERN UNIVERSITY,NORTHEASTERN UNIVERSITY,NORTHEASTERN UNIVERSITY
NORTHERN ARIZONA UNIVERSITY,NORTHERN ARIZONA UNIVERSITY,NORTHERN ARIZONA UNIVERSITY
NORTHERN CALIFORNIA CANCER CENTER,NORTHERN CALIFORNIA CANCER CENTER,NORTHERN CALIFORNIA CANCER CENTER
NORTHERN CALIFORNIA INSTITUTE FOR RESEARCH AND EDUCATION,NORTHERN CALIFORNIA INSTITUTE FOR RESEARCH AND EDUCATION,NORTHERN CALIFORNIA INSTITUTE FOR RESEARCH AND EDUCATION
NORTHERN ILLINOIS UNIVERSITY,NORTHERN ILLINOIS UNIVERSITY,NORTHERN ILLINOIS UNIVERSITY
NORTHWESTERN MEMORIAL HOSPITAL,,RELEVANT INSTITUTION NOT IN AGREEMENTS
NORTHWESTERN UNIVERSITY,NORTHWESTERN UNIVERSITY,NORTHWESTERN UNIVERSITY
NOVA SOUTHEASTERN UNIVERSITY,NOVA SOUTHEASTERN UNIVERSITY,NOVA SOUTHEASTERN UNIVERSITY
OAKLAND UNIVERSITY,OAKLAND UNIVERSITY,OAKLAND UNIVERSITY
OBERLIN COLLEGE,OBERLIN COLLEGE,OBERLIN COLLEGE
OCHSNER CLINIC FOUNDATION,OCHSNER CLINIC FOUNDATION,OCHSNER CLINIC FOUNDATION
OHIO STATE UNIVERSITY,OHIO STATE UNIVERSITY,OHIO STATE UNIVERSITY
OHIO UNIVERSITY AT ATHENS,OHIO UNIVERSITY,OHIO UNIVERSITY
OKLAHOMA MEDICAL RESEARCH FOUNDATION,OKLAHOMA MEDICAL RESEARCH FOUNDATION,OKLAHOMA MEDICAL RESEARCH FOUNDATION
OKLAHOMA STATE UNIVERSITY AT STILLWATER,OKLAHOMA STATE UNIVERSITY AT STILLWATER,OKLAHOMA STATE UNIVERSITY
OKLAHOMA STATE UNIVERSITY CENTER FOR HEALTH SCIENCES,OKLAHOMA STATE UNIVERSITY CENTER FOR HEALTH SCIENCES,OKLAHOMA STATE UNIVERSITY
OLD DOMINION UNIVERSITY,OLD DOMINION UNIVERSITY,OLD DOMINION UNIVERSITY
OLD DOMINION UNIVERSITY,OLD DOMINION UNIVERSITY RESEARCH FOUNDATION,OLD DOMINION UNIVERSITY RESEARCH FOUNDATION
OLIVE VIEW-UCLA EDUCATION AND RESEARCH INSTITUTE,OLIVE VIEW-UCLA EDUCATION AND RESEARCH INSTITUTE,OLIVE VIEW-UCLA EDUCATION AND RESEARCH INSTITUTE
ORAL ROBERTS UNIVERSITY,ORAL ROBERTS UNIVERSITY,ORAL ROBERTS UNIVERSITY
OREGON GRADUATE INSTITUTE OF SCIENCE AND TECHNOLOGY,OREGON GRADUATE INSTITUTE OF SCIENCE AND TECHNOLOGY,OREGON GRADUATE INSTITUTE OF SCIENCE AND TECHNOLOGY
OREGON HEALTH AND SCIENCE UNIVERSITY,OREGON HEALTH AND SCIENCE UNIVERSITY,OREGON HEALTH AND SCIENCE UNIVERSITY
OREGON HEALTH AND SCIENCE UNIVERSITY,OREGON HEALTH SCIENCES UNIVERSITY,OREGON HEALTH SCIENCES UNIVERSITY
OREGON NATIONAL PRIMATE RESEARCH CENTER,OREGON NATIONAL PRIMATE RESEARCH CENTER,OREGON HEALTH AND SCIENCE UNIVERSITY
OREGON NATIONAL PRIMATE RESEARCH CENTER,OREGON NATIONAL PRIMATE RESEARCH CENTER,OREGON HEALTH SCIENCES UNIVERSITY
OREGON RESEARCH INSTITUTE,OREGON RESEARCH INSTITUTE,OREGON RESEARCH INSTITUTE
"OREGON SOCIAL LEARNING CENTER, INC.",OREGON SOCIAL LEARNING CENTER,OREGON SOCIAL LEARNING CENTER
OREGON STATE UNIVERSITY,OREGON STATE UNIVERSITY,OREGON STATE UNIVERSITY
PACIFIC INSTITUTE FOR RESEARCH AND EVALUATION,PACIFIC INSTITUTE FOR RESEARCH AND EVALUATION,PACIFIC INSTITUTE FOR RESEARCH AND EVALUATION
PACIFIC NORTHWEST RESEARCH INSTITUTE,PACIFIC NORTHWEST RESEARCH INSTITUTE,PACIFIC NORTHWEST RESEARCH INSTITUTE
"PALO ALTO INSTITUTE FOR RESEARCH AND EDUCATION, INC.","PALO ALTO INSTITUTE FOR RESEARCH AND EDUCATION, INC.","PALO ALTO INSTITUTE FOR RESEARCH AND EDUCATION, INC."
PALO ALTO MEDICAL FOUNDATION,PALO ALTO MEDICAL FOUNDATION,PALO ALTO MEDICAL FOUNDATION
PAPANICOLAOU CANCER RESEARCH INSTITUTE,,RELEVANT INSTITUTION NOT IN AGREEMENTS
PARK NICOLLET INSTITUTE,PARK NICOLLET INSTITUTE,PARK NICOLLET INSTITUTE
PENNSYLVANIA COLLEGE OF OPTOMETRY,PENNSYLVANIA COLLEGE OF OPTOMETRY,PENNSYLVANIA COLLEGE OF OPTOMETRY
PENNSYLVANIA HOSPITAL (PHILADELPHIA),,RELEVANT INSTITUTION NOT IN AGREEMENTS
PENNSYLVANIA STATE UNIVERSITY AT UNIVERSITY PARK,PENNSYLVANIA STATE UNIVERSITY,PENNSYLVANIA STATE UNIVERSITY
PENNSYLVANIA STATE UNIVERSITY AT UNIVERSITY PARK,THE PENNSYLVANIA STATE UNIVERSITY,THE PENNSYLVANIA STATE UNIVERSITY
PENNSYLVANIA STATE UNIVERSITY HERSHEY MEDICAL CENTER,HERSHEY MEDICAL CENTER,PENNSYLVANIA STATE UNIVERSITY
PENNSYLVANIA STATE UNIVERSITY HERSHEY MEDICAL CENTER,HERSHEY MEDICAL CENTER,THE PENNSYLVANIA STATE UNIVERSITY
PHILADELPHIA COLLEGE OF OSTEOPATHIC MEDICINE,PHILADELPHIA COLLEGE OF OSTEOPATHIC MEDICINE,PHILADELPHIA COLLEGE OF OSTEOPATHIC MEDICINE
PICOWER INSTITUTE FOR MEDICAL RESEARCH,,RELEVANT INSTITUTION NOT IN AGREEMENTS
POMONA COLLEGE,POMONA COLLEGE,POMONA COLLEGE
PONCE SCHOOL OF MEDICINE,PONCE SCHOOL OF MEDICINE,PONCE SCHOOL OF MEDICINE
POPULATION COUNCIL,,RELEVANT INSTITUTION NOT IN AGREEMENTS
PORTLAND STATE UNIVERSITY,PORTLAND STATE UNIVERSITY,PORTLAND STATE UNIVERSITY
PRESBYTERIAN MEDICAL CENTER OF PHILADELPHIA,,RELEVANT INSTITUTION NOT IN AGREEMENTS
PRIMARY CHILDRENS MEDICAL CENTER,,RELEVANT INSTITUTION NOT IN AGREEMENTS
PRIMARY HEALTH SYSTEMS - MOUNT SINAI MEDICAL CENTER,,RELEVANT INSTITUTION NOT IN AGREEMENTS
PRINCETON UNIVERSITY,PRINCETON UNIVERSITY,PRINCETON UNIVERSITY
"PROVIDENCE MEDICAL CENTER (SEATTLE, WA)",,RELEVANT INSTITUTION NOT IN AGREEMENTS
PROVIDENCE PORTLAND MEDICAL CENTER,PROVIDENCE MEDICAL CENTER,PROVIDENCE MEDICAL CENTER
PUBLIC HEALTH FOUNDATION ENTERPRISES,"PUBLIC HEALTH FOUNDATION ENTERPRISES, INC.","PUBLIC HEALTH FOUNDATION ENTERPRISES, INC."
PUBLIC HEALTH INSTITUTE,PUBLIC HEALTH INSTITUTE,PUBLIC HEALTH INSTITUTE
PUBLIC HEALTH RESEARCH INSTITUTE OF THE CITY OF NEW YORK,PUBLIC HEALTH RESEARCH INSTITUTE,PUBLIC HEALTH RESEARCH INSTITUTE
PUGET SOUND BLOOD CENTER,PUGET SOUND BLOOD CENTER,PUGET SOUND BLOOD CENTER
PURDUE UNIVERSITY AT WEST LAFAYETTE,PURDUE UNIVERSITY,PURDUE UNIVERSITY
RALPH K. DAVIES MEDICAL CENTER - FRANKLIN HOSPITAL,,RELEVANT INSTITUTION NOT IN AGREEMENTS
RANCHO LOS AMIGOS MEDICAL CENTER,,RELEVANT INSTITUTION NOT IN AGREEMENTS
RAND CORPORATION,,RELEVANT INSTITUTION NOT IN AGREEMENTS
REED COLLEGE,REED COLLEGE,REED COLLEGE
REHABILITATION INSTITUTE OF CHICAGO,REHABILITATION INSTITUTE RESEARCH CORPORATION,REHABILITATION INSTITUTE RESEARCH CORPORATION
RENSSELAER POLYTECHNIC INSTITUTE,RENSSELAER POLYTECHNIC INSTITUTE,RENSSELAER POLYTECHNIC INSTITUTE
RESEARCH TRIANGLE INSTITUTE,,RELEVANT INSTITUTION NOT IN AGREEMENTS
RESOURCE DEVELOPMENT INSTITUTE,,RELEVANT INSTITUTION NOT IN AGREEMENTS
RETINA FOUNDATION OF THE SOUTHWEST,RETINA FOUNDATION OF THE SOUTHWEST,RETINA FOUNDATION OF THE SOUTHWEST
RHODE ISLAND HOSPITAL,RHODE ISLAND HOSPITAL/LIFESPAN,RHODE ISLAND HOSPITAL/LIFESPAN
RICE UNIVERSITY,RICE UNIVERSITY,RICE UNIVERSITY
RIVERSIDE RESEARCH INSTITUTE,RIVERSIDE RESEARCH INSTITUTE,RIVERSIDE RESEARCH INSTITUTE
ROCHESTER GENERAL HOSPITAL (NY),,RELEVANT INSTITUTION NOT IN AGREEMENTS
ROCKEFELLER UNIVERSITY,ROCKEFELLER UNIVERSITY,ROCKEFELLER UNIVERSITY
ROCKEFELLER UNIVERSITY,ROCKEFELLER UNIVERSITY HOSPITAL,ROCKEFELLER UNIVERSITY HOSPITAL
ROGER WILLIAMS HOSPITAL,ROGER WILLIAMS HOSPITAL,ROGER WILLIAMS HOSPITAL
ROSALIND FRANKLIN UNIVERSITY OF MEDICINE AND SCIENCE,ROSALIND FRANKLIN UNIVERSITY OF MEDICINE AND SCIENCE,ROSALIND FRANKLIN UNIVERSITY OF MEDICINE AND SCIENCE
ROSALIND FRANKLIN UNIVERSITY OF MEDICINE AND SCIENCE,UNIVERSITY OF HEALTH SCIENCES/CHICAGO MEDICAL SCHOOL,UNIVERSITY OF HEALTH SCIENCES/CHICAGO MEDICAL SCHOOL
ROSWELL PARK CANCER INSTITUTE,ROSWELL PARK CANCER INSTITUTE,"HEALTH RESEARCH, INC."
RUSH UNIVERSITY MEDICAL CENTER,RUSH UNIVERSITY MEDICAL CENTER,RUSH UNIVERSITY MEDICAL CENTER
RUTGERS UNIVERSITY AT CAMDEN,,RELEVANT INSTITUTION NOT IN AGREEMENTS
RUTGERS UNIVERSITY AT NEW BRUNSWICK,RUTGERS UNIVERSITY,RUTGERS UNIVERSITY
RUTGERS UNIVERSITY AT NEWARK,,RELEVANT INSTITUTION NOT IN AGREEMENTS
SAINT CHRISTOPHERS HOSPITAL FOR CHILDREN (PHILADELPHIA),,RELEVANT INSTITUTION NOT IN AGREEMENTS
SAINT ELIZABETHS MEDICAL CENTER OF BOSTON,ST. ELIZABETH'S MEDICAL CENTER OF BOSTON,ST. ELIZABETH'S MEDICAL CENTER OF BOSTON
SAINT FRANCIS HOSPITAL AND MEDICAL CENTER,SAINT FRANCIS HOSPITAL AND MEDICAL CENTER,SAINT FRANCIS HOSPITAL AND MEDICAL CENTER
SAINT JOHNS UNIVERSITY (QUEENS),ST. JOHN'S UNIVERSITY,ST. JOHN'S UNIVERSITY
"SAINT JOSEPHS HOSPITAL (PHILADELPHIA, PA)",,RELEVANT INSTITUTION NOT IN AGREEMENTS
SAINT JOSEPHS HOSPITAL AND MEDICAL CENTER (PHOENIX),ST. JOSEPH'S HOSPITAL AND MEDICAL CENTER,ST. JOSEPH'S HOSPITAL AND MEDICAL CENTER
SAINT JUDE CHILDRENS RESEARCH HOSPITAL,SAINT JUDE CHILDREN'S RESEARCH HOSPITAL,SAINT JUDE CHILDREN'S RESEARCH HOSPITAL
SAINT LOUIS UNIVERSITY,ST. LOUIS UNIVERSITY,ST. LOUIS UNIVERSITY
SAINT LUKE'S HOSPITAL OF KANSAS CITY,,RELEVANT INSTITUTION NOT IN AGREEMENTS
"SAINT LUKES MEDICAL CENTER (CLEVELAND, OH)",,RELEVANT INSTITUTION NOT IN AGREEMENTS
SAINT LUKES-ROOSEVELT HOSPITAL CENTER,ST. LUKE'S ROOSEVELT HOSPITAL CENTER,ST. LUKE'S ROOSEVELT HOSPITAL CENTER
"SAINT VINCENT HOSPITAL (WORCESTER, MA)",,RELEVANT INSTITUTION NOT IN AGREEMENTS
SAN DIEGO STATE UNIVERSITY,SAN DIEGO STATE UNIVERSITY FOUNDATION,SAN DIEGO STATE UNIVERSITY FOUNDATION
SAN FRANCISCO GENERAL HOSPITAL MEDICAL CENTER,,RELEVANT INSTITUTION NOT IN AGREEMENTS
SAN FRANCISCO STATE UNIVERSITY,SAN FRANCISCO STATE UNIVERSITY,SAN FRANCISCO STATE UNIVERSITY
SAN JOSE STATE UNIVERSITY,SAN JOSE STATE UNIVERSITY AND THE FOUNDATION,SAN JOSE STATE UNIVERSITY AND THE FOUNDATION
SANTA CLARA VALLEY MEDICAL CENTER,,RELEVANT INSTITUTION NOT IN AGREEMENTS
SCHEPENS EYE RESEARCH INSTITUTE,"SCHEPENS EYE RESEARCH INSTITUTE, INC.","SCHEPENS EYE RESEARCH INSTITUTE, INC."
SCIENTIFIC ANALYSIS CORPORATION,SCIENTIFIC ANALYSIS CORPORATION,SCIENTIFIC ANALYSIS CORPORATION
SCOTT AND WHITE MEMORIAL HOSPITAL,SCOTT AND WHITE MEMORIAL HOSPITAL,SCOTT AND WHITE MEMORIAL HOSPITAL
SCRIPPS RESEARCH INSTITUTE - CALIFORNIA,SCRIPPS RESEARCH INSTITUTE - CALIFORNIA,SCRIPPS RESEARCH INSTITUTE
SCRIPPS RESEARCH INSTITUTE - FLORIDA,SCRIPPS RESEARCH INSTITUTE - FLORIDA,SCRIPPS RESEARCH INSTITUTE
SEATTLE BIOMEDICAL RESEARCH INSTITUTE,SEATTLE BIOMEDICAL RESEARCH INSTITUTE,SEATTLE BIOMEDICAL RESEARCH INSTITUTE
SEATTLE INSTITUTE FOR BIOMEDICAL AND CLINICAL RESEARCH,SEATTLE INSTITUTE FOR BIOMEDICAL AND CLINICAL RESEARCH,SEATTLE INSTITUTE FOR BIOMEDICAL AND CLINICAL RESEARCH
SETON HALL UNIVERSITY,SETON HALL UNIVERSITY,SETON HALL UNIVERSITY
SIDNEY KIMMEL CANCER CENTER,SIDNEY KIMMEL CANCER CENTER,SIDNEY KIMMEL CANCER CENTER
SINAI HOSPITAL OF BALTIMORE,SINAI HOSPITAL OF BALTIMORE,SINAI HOSPITAL OF BALTIMORE
SINAI HOSPITAL OF DETROIT,,RELEVANT INSTITUTION NOT IN AGREEMENTS
"SINAI SAMARITAN MEDICAL CENTER (MILWAUKEE, WI)",,RELEVANT INSTITUTION NOT IN AGREEMENTS
SMITH COLLEGE,SMITH COLLEGE,SMITH COLLEGE
SMITH-KETTLEWELL EYE RESEARCH INSTITUTE,SMITH-KETTLEWELL EYE RESEARCH FOUNDATION,SMITH-KETTLEWELL EYE RESEARCH FOUNDATION
SOUTH DAKOTA STATE UNIVERSITY,SOUTH DAKOTA STATE UNIVERSITY,SOUTH DAKOTA STATE UNIVERSITY
SOUTHERN ILLINOIS UNIVERSITY AT CARBONDALE,SOUTHERN ILLINOIS UNIVERSITY AT CARBONDALE,SOUTHERN ILLINOIS UNIVERSITY AT CARBONDALE
SOUTHERN ILLINOIS UNIVERSITY AT EDWARDSVILLE,SOUTHERN ILLINOIS UNIVERSITY AT EDWARDSVILLE,SOUTHERN ILLINOIS UNIVERSITY AT EDWARDSVILLE
SOUTHERN ILLINOIS UNIVERSITY SCHOOL OF MEDICINE,,RELEVANT INSTITUTION NOT IN AGREEMENTS
SOUTHERN METHODIST UNIVERSITY,SOUTHERN METHODIST UNIVERSITY,SOUTHERN METHODIST UNIVERSITY
SOUTHERN RESEARCH INSTITUTE,,RELEVANT INSTITUTION NOT IN AGREEMENTS
SOUTHWEST FOUNDATION FOR BIOMEDICAL RESEARCH,SOUTHWEST FOUNDATION FOR BIOMEDICAL RESEARCH,SOUTHWEST FOUNDATION FOR BIOMEDICAL RESEARCH
SRI INTERNATIONAL,,RELEVANT INSTITUTION NOT IN AGREEMENTS
ST VINCENT MEDICAL CENTER,ST. VINCENT MERCY MEDICAL CENTER,ST. VINCENT MERCY MEDICAL CENTER
ST. VINCENTS HOSPITAL AND MEDICAL CENTER,ST. VINCENT'S HOSPITAL AND MEDICAL CENTER,ST. VINCENT'S HOSPITAL AND MEDICAL CENTER
STANFORD UNIVERSITY,STANFORD UNIVERSITY,STANFORD UNIVERSITY
STEVENS INSTITUTE OF TECHNOLOGY,STEVENS INSTITUTE OF TECHNOLOGY,STEVENS INSTITUTE OF TECHNOLOGY
STOWERS INSTITUTE FOR MEDICAL RESEARCH,STOWERS INSTITUTE,STOWERS INSTITUTE
SUN HEALTH RESEARCH INSTITUTE,SUN HEALTH RESEARCH INSTITUTE,SUN HEALTH RESEARCH INSTITUTE
SUNY - BUFFALO STATE COLLEGE,SUNY - BUFFALO STATE COLLEGE,SUNY - BUFFALO STATE COLLEGE
SUNY - COLLEGE OF ENVIRONMENTAL SCIENCE AND FORESTRY,SUNY - COLLEGE OF ENVIRONMENTAL SCIENCE AND FORESTRY,SUNY - COLLEGE OF ENVIRONMENTAL SCIENCE AND FORESTRY
SUNY - COLLEGE OF OPTOMETRY,SUNY - COLLEGE OF OPTOMETRY,SUNY - COLLEGE OF OPTOMETRY
SUNY - DOWNSTATE MEDICAL CENTER,SUNY - DOWNSTATE MEDICAL CENTER,SUNY - DOWNSTATE MEDICAL CENTER
SUNY - STATE UNIVERSITY OF NEW YORK AT ALBANY,SUNY - STATE UNIVERSITY OF NEW YORK AT ALBANY,SUNY - STATE UNIVERSITY OF NEW YORK AT ALBANY
SUNY - STATE UNIVERSITY OF NEW YORK AT BINGHAMTON,SUNY - STATE UNIVERSITY OF NEW YORK AT BINGHAMTON,SUNY - STATE UNIVERSITY OF NEW YORK AT BINGHAMTON
SUNY - STATE UNIVERSITY OF NEW YORK AT BROCKPORT,SUNY - STATE UNIVERSITY OF NEW YORK AT BROCKPORT,SUNY - STATE UNIVERSITY OF NEW YORK AT BROCKPORT
SUNY - STATE UNIVERSITY OF NEW YORK AT BUFFALO,SUNY - STATE UNIVERSITY OF NEW YORK AT BUFFALO,SUNY - STATE UNIVERSITY OF NEW YORK AT BUFFALO
SUNY - STATE UNIVERSITY OF NEW YORK AT OSWEGO,SUNY - STATE UNIVERSITY OF NEW YORK AT OSWEGO,SUNY - STATE UNIVERSITY OF NEW YORK AT OSWEGO
SUNY - STATE UNIVERSITY OF NEW YORK AT PLATTSBURG,SUNY - STATE UNIVERSITY OF NEW YORK AT PLATTSBURG,SUNY - STATE UNIVERSITY OF NEW YORK AT PLATTSBURG
SUNY - STATE UNIVERSITY OF NEW YORK AT PURCHASE,SUNY - STATE UNIVERSITY OF NEW YORK AT PURCHASE,SUNY - STATE UNIVERSITY OF NEW YORK AT PURCHASE
SUNY - STATE UNIVERSITY OF NEW YORK AT STONYBROOK,SUNY - STATE UNIVERSITY OF NEW YORK AT STONYBROOK,SUNY - STATE UNIVERSITY OF NEW YORK AT STONYBROOK
SUNY - UPSTATE MEDICAL UNIVERSITY,SUNY - UPSTATE MEDICAL UNIVERSITY,SUNY - UPSTATE MEDICAL UNIVERSITY
SWARTHMORE COLLEGE,SWARTHMORE COLLEGE,SWARTHMORE COLLEGE
"SWEDISH MEDICAL CENTER, FIRST HILL",SWEDISH MEDICAL CENTER,SWEDISH MEDICAL CENTER
SYRACUSE UNIVERSITY,SYRACUSE UNIVERSITY,SYRACUSE UNIVERSITY
TAMPA BAY RESEARCH INSTITUTE,,RELEVANT INSTITUTION NOT IN AGREEMENTS
TEMPLE UNIVERSITY,TEMPLE UNIVERSITY,TEMPLE UNIVERSITY
TEXAS AGRICULTURAL AND MECHANICAL BAYLOR COLLEGE OF DENTISTRY,BAYLOR COLLEGE OF DENTISTRY,BAYLOR COLLEGE OF DENTISTRY
TEXAS AGRICULTURAL AND MECHANICAL UNIVERSITY AGRICULTURAL EXPERIMENT STATION,,RELEVANT INSTITUTION NOT IN AGREEMENTS
TEXAS AGRICULTURAL AND MECHANICAL UNIVERSITY AT COLLEGE STATION,TEXAS AGRICULTURAL AND MECHANICAL UNIVERSITY AT COLLEGE STATION,TEXAS AGRICULTURAL AND MECHANICAL UNIVERSITY AT COLLEGE STATION
TEXAS AGRICULTURAL AND MECHANICAL UNIVERSITY ENGINEERING EXPERIMENT STATION,,RELEVANT INSTITUTION NOT IN AGREEMENTS
TEXAS AGRICULTURAL AND MECHANICAL UNIVERSITY HEALTH SCIENCE CENTER,,RELEVANT INSTITUTION NOT IN AGREEMENTS
TEXAS CENTER FOR INFECTIOUS DISEASE,,RELEVANT INSTITUTION NOT IN AGREEMENTS
TEXAS CHRISTIAN UNIVERSITY,TEXAS CHRISTIAN UNIVERSITY,TEXAS CHRISTIAN UNIVERSITY
TEXAS RESEARCH INSTITUTE OF MENTAL SCIENCES,,RELEVANT INSTITUTION NOT IN AGREEMENTS
TEXAS TECH UNIVERSITY,TEXAS TECH UNIVERSITY,TEXAS TECH UNIVERSITY
TEXAS TECH UNIVERSITY HEALTH SCIENCES CENTER,TEXAS TECH UNIVERSITY HEALTH SCIENCES CENTER,TEXAS TECH UNIVERSITY HEALTH SCIENCES CENTER
TEXAS WOMANS UNIVERSITY,TEXAS WOMAN'S UNIVERSITY,TEXAS WOMAN'S UNIVERSITY
THE ALAN GUTTMACHER INSTITUTE,THE ALAN GUTTMACHER INSTITUTE,THE ALAN GUTTMACHER INSTITUTE
THE APT FOUNDATION,THE APT FOUNDATION,THE APT FOUNDATION
THE BROOKDALE UNIVERSITY HOSPITAL AND MEDICAL CENTER,THE BROOKDALE UNIVERSITY HOSPITAL AND MEDICAL CENTER,THE BROOKDALE UNIVERSITY HOSPITAL AND MEDICAL CENTER
