final_institution,post_subinstitution,original_institution
AARON DIAMOND AIDS RESEARCH CENTER,THE AARON DIAMOND AIDS RESEARCH CENTER,THE AARON DIAMOND AIDS RESEARCH CENTER
"ABT ASSOCIATES, INC.",,RELEVANT INSTITUTION NOT IN AGREEMENTS
ADDICTION RESEARCH INSTITUTE,,RELEVANT INSTITUTION NOT IN AGREEMENTS
ADELPHI UNIVERSITY,ADELPHI UNIVERSITY,ADELPHI UNIVERSITY
ADIRONDACK BIOMEDICAL RESEARCH INSTITUTE,,RELEVANT INSTITUTION NOT IN AGREEMENTS
AKRON CITY HOSPITAL,,RELEVANT INSTITUTION NOT IN AGREEMENTS
ALBANY MEDICAL CENTER,ALBANY MEDICAL COLLEGE OF UNION UNIVERSITY,ALBANY MEDICAL COLLEGE OF UNION UNIVERSITY
ALBERT EINSTEIN MEDICAL CENTER,ALBERT EINSTEIN HEALTHCARE NETWORK,ALBERT EINSTEIN HEALTHCARE NETWORK
ALBERT EINSTEIN MEDICAL CENTER,ALBERT EINSTEIN MEDICAL CENTER,ALBERT EINSTEIN HEALTHCARE NETWORK
ALFRED I. DU PONT HOSPITAL FOR CHILDREN,,RELEVANT INSTITUTION NOT IN AGREEMENTS
ALLEGHENY UNIVERSITY OF HEALTH SCIENCES (MCP HAHNEMANN UNIVERSITY),ALLEGHENY UNIVERSITY OF THE HEALTH SCIENCES,ALLEGHENY UNIVERSITY OF THE HEALTH SCIENCES
ALLEGHENY UNIVERSITY OF HEALTH SCIENCES (MCP HAHNEMANN UNIVERSITY),HAHNEMANN UNIVERSITY,HAHNEMANN UNIVERSITY
ALLEGHENY UNIVERSITY OF HEALTH SCIENCES (MCP HAHNEMANN UNIVERSITY),MEDICAL COLLEGE OF PENNSYLVANIA,MEDICAL COLLEGE OF PENNSYLVANIA
ALLEGHENY UNIVERSITY OF HEALTH SCIENCES (MCP HAHNEMANN UNIVERSITY),PHILADELPHIA HEALTH AND EDUCATION CORPORATION,PHILADELPHIA HEALTH AND EDUCATION CORPORATION
ALLEGHENY-SINGER RESEARCH INSTITUTE,ALLEGHENY-SINGER RESEARCH INSTITUTE,ALLEGHENY-SINGER RESEARCH INSTITUTE
ALTA BATES SUMMIT MEDICAL CENTER,,RELEVANT INSTITUTION NOT IN AGREEMENTS
AMC CANCER RESEARCH CENTER,,RELEVANT INSTITUTION NOT IN AGREEMENTS
AMERICAN DENTAL ASSOCIATION AND HEALTH FOUNDATION,AMERICAN DENTAL ASSOCIATION AND HEALTH FOUNDATION,AMERICAN DENTAL ASSOCIATION AND HEALTH FOUNDATION
AMERICAN INSTITUTES FOR RESEARCH,,RELEVANT INSTITUTION NOT IN AGREEMENTS
AMERICAN MUSEUM OF NATURAL HISTORY,,RELEVANT INSTITUTION NOT IN AGREEMENTS
AMERICAN NATIONAL RED CROSS,AMERICAN RED CROSS - NATIONAL HEADQUARTERS,AMERICAN RED CROSS - NATIONAL HEADQUARTERS
AMERICAN NATIONAL RED CROSS,"AMERICAN RED CROSS, NATIONAL CAPITAL AREA CHAPTER","AMERICAN RED CROSS, NATIONAL CAPITAL AREA CHAPTER"
"AMERICAN REGISTRY OF PATHOLOGY, INC.",,RELEVANT INSTITUTION NOT IN AGREEMENTS
AMERICAN UNIVERSITY,THE AMERICAN UNIVERSITY,THE AMERICAN UNIVERSITY
AMHERST COLLEGE,AMHERST COLLEGE,AMHERST COLLEGE
ARIZONA STATE UNIVERSITY,ARIZONA STATE UNIVERSITY,ARIZONA STATE UNIVERSITY
ARKANSAS CHILDRENS HOSPITAL RESEARCH INSTITUTE,ARKANSAS CHILDREN'S HOSPITAL RESEARCH CENTER,ARKANSAS CHILDREN'S HOSPITAL RESEARCH CENTER
AUBURN UNIVERSITY AT AUBURN,AUBURN UNIVERSITY,AUBURN UNIVERSITY
BALL STATE UNIVERSITY,BALL STATE UNIVERSITY,BALL STATE UNIVERSITY
BALTIMORE CITY HOSPITALS,,RELEVANT INSTITUTION NOT IN AGREEMENTS
BARNARD COLLEGE,BARNARD COLLEGE,BARNARD COLLEGE
BARNES-JEWISH HOSPITAL,BARNES-JEWISH HOSPITAL,BARNES-JEWISH HOSPITAL
BATTELLE CENTERS FOR PUBLIC HEALTH RESEARCH AND EVALUATION,,RELEVANT INSTITUTION NOT IN AGREEMENTS
BATTELLE MEMORIAL INSTITUTE,,RELEVANT INSTITUTION NOT IN AGREEMENTS
BATTELLE PACIFIC NORTHWEST LABORATORIES,,RELEVANT INSTITUTION NOT IN AGREEMENTS
BAYLOR COLLEGE OF MEDICINE,BAYLOR COLLEGE OF MEDICINE,BAYLOR COLLEGE OF MEDICINE
BAYLOR RESEARCH INSTITUTE,BAYLOR RESEARCH INSTITUTE,BAYLOR RESEARCH INSTITUTE
BAYLOR UNIVERSITY,BAYLOR UNIVERSITY,BAYLOR UNIVERSITY
BECKMAN RESEARCH INSTITUTE OF CITY OF HOPE,BECKMAN RESEARCH INSTITUTE,BECKMAN RESEARCH INSTITUTE
BELMONT CENTER FOR COMPREHENSIVE TREATMENT,,RELEVANT INSTITUTION NOT IN AGREEMENTS
BENAROYA RESEARCH INSTITUTE AT VIRGINIA MASON,BENAROYA RESEARCH INSTITUTE AT VIRGINIA MASON,BENAROYA RESEARCH INSTITUTE AT VIRGINIA MASON
BETH ISRAEL DEACONESS MEDICAL CENTER,BETH ISRAEL DEACONESS MEDICAL CENTER,BETH ISRAEL DEACONESS MEDICAL CENTER
"BETH ISRAEL HOSPITAL (PASSAIC, NJ)",,RELEVANT INSTITUTION NOT IN AGREEMENTS
BETH ISRAEL MEDICAL CENTER (NEW YORK),BETH ISRAEL MEDICAL CENTER,BETH ISRAEL MEDICAL CENTER
BILL WILKERSON HEARING AND SPEECH CENTER,,RELEVANT INSTITUTION NOT IN AGREEMENTS
"BIO-RESEARCH INSTITUTE, INC.",,RELEVANT INSTITUTION NOT IN AGREEMENTS
BLOODCENTER OF WISCONSIN INC,BLOODCENTER OF WISCONSIN,BLOODCENTER OF WISCONSIN
BOSTON BIOMEDICAL RESEARCH INSTITUTE,BOSTON BIOMEDICAL RESEARCH INSTITUTE,BOSTON BIOMEDICAL RESEARCH INSTITUTE
BOSTON COLLEGE,BOSTON COLLEGE,BOSTON COLLEGE
BOSTON HEALTH AND HOSPITALS DEPARTMENT,,RELEVANT INSTITUTION NOT IN AGREEMENTS
BOSTON MEDICAL CENTER,BOSTON MEDICAL CENTER,BOSTON MEDICAL CENTER
BOSTON UNIVERSITY,BOSTON UNIVERSITY,BOSTON UNIVERSITY
BOWDOIN COLLEGE,BOWDOIN COLLEGE,BOWDOIN COLLEGE
BOWLING GREEN STATE UNIVERSITY,BOWLING GREEN STATE UNIVERSITY,BOWLING GREEN STATE UNIVERSITY
BOYCE THOMPSON INST FOR PLANT RESEARCH,"BOYCE THOMPSON INSTITUTE FOR PLANT RESEARCH, INC.","BOYCE THOMPSON INSTITUTE FOR PLANT RESEARCH, INC."
BRANDEIS UNIVERSITY,BRANDEIS UNIVERSITY,BRANDEIS UNIVERSITY
BRENTWOOD BIOMEDICAL RESEARCH INSTITUTE,BRENTWOOD BIOMEDICAL RESEARCH INSTITUTE,BRENTWOOD BIOMEDICAL RESEARCH INSTITUTE
BRIGHAM AND WOMENS HOSPITAL,BRIGHAM AND WOMEN'S HOSPITAL,BRIGHAM AND WOMEN'S HOSPITAL
BRIGHAM YOUNG UNIVERSITY,BRIGHAM YOUNG UNIVERSITY,BRIGHAM YOUNG UNIVERSITY
BRONX-LEBANON HOSPITAL CENTER,BRONX-LEBANON HOSPITAL CENTER,BRONX-LEBANON HOSPITAL CENTER
BROOKLYN HOSPITAL CENTER,,RELEVANT INSTITUTION NOT IN AGREEMENTS
BROWN UNIVERSITY,BROWN UNIVERSITY,BROWN UNIVERSITY
BRYN MAWR COLLEGE,BRYN MAWR COLLEGE,BRYN MAWR COLLEGE
BUCK INSTITUTE FOR AGE RESEARCH,BUCK INSTITUTE FOR AGE RESEARCH,BUCK INSTITUTE FOR AGE RESEARCH
BUCKNELL UNIVERSITY,BUCKNELL UNIVERSITY,BUCKNELL UNIVERSITY
BUTLER HOSPITAL (PROVIDENCE RI),BUTLER HOSPITAL,BUTLER HOSPITAL
CALIFORNIA INSTITUTE FOR MEDICAL RESEARCH,CALIFORNIA INSTITUTE FOR MEDICAL RESEARCH,CALIFORNIA INSTITUTE FOR MEDICAL RESEARCH
CALIFORNIA INSTITUTE OF BIOLOGICAL RESEARCH,,RELEVANT INSTITUTION NOT IN AGREEMENTS
CALIFORNIA INSTITUTE OF TECHNOLOGY,CALIFORNIA INSTITUTE OF TECHNOLOGY,CALIFORNIA INSTITUTE OF TECHNOLOGY
CALIFORNIA PACIFIC MEDICAL CENTER RESEARCH INSTITUTE,CALIFORNIA PACIFIC MEDICAL CENTER RESEARCH INSTITUTE,CALIFORNIA PACIFIC MEDICAL CENTER RESEARCH INSTITUTE
CALIFORNIA STATE UNIVERSITY AT BAKERSFIELD,CALIFORNIA STATE UNIVERSITY AT BAKERSFIELD,CALIFORNIA STATE UNIVERSITY AT BAKERSFIELD
CALIFORNIA STATE UNIVERSITY AT CHICO,CALIFORNIA STATE UNIVERSITY AT CHICO,CALIFORNIA STATE UNIVERSITY AT CHICO
CALIFORNIA STATE UNIVERSITY AT FRESNO,CALIFORNIA STATE UNIVERSITY - FRESNO FOUNDATION,CALIFORNIA STATE UNIVERSITY - FRESNO FOUNDATION
CALIFORNIA STATE UNIVERSITY AT FRESNO,CALIFORNIA STATE UNIVERSITY AT FRESNO,CALIFORNIA STATE UNIVERSITY AT FRESNO
CALIFORNIA STATE UNIVERSITY AT FULLERTON,CALIFORNIA STATE UNIVERSITY AT FULLERTON,CALIFORNIA STATE UNIVERSITY AT FULLERTON
CALIFORNIA STATE UNIVERSITY AT HAYWARD,CALIFORNIA STATE UNIVERSITY AT HAYWARD,CALIFORNIA STATE UNIVERSITY AT HAYWARD
CALIFORNIA STATE UNIVERSITY AT HUMBOLDT,CALIFORNIA STATE UNIVERSITY AT HUMBOLDT,CALIFORNIA STATE UNIVERSITY AT HUMBOLDT
CALIFORNIA STATE UNIVERSITY AT LONG BEACH,CALIFORNIA STATE UNIVERSITY AT LONG BEACH,CALIFORNIA STATE UNIVERSITY AT LONG BEACH
CALIFORNIA STATE UNIVERSITY AT LOS ANGELES,"CALIFORNIA STATE UNIVERSITY AT LOS ANGELES - AUXILIARY SERVICES, INC.","CALIFORNIA STATE UNIVERSITY AT LOS ANGELES - AUXILIARY SERVICES, INC."
CALIFORNIA STATE UNIVERSITY AT NORTHRIDGE,CALIFORNIA STATE UNIVERSITY AT NORTHRIDGE,CALIFORNIA STATE UNIVERSITY AT NORTHRIDGE
CALIFORNIA STATE UNIVERSITY AT SACREMENTO,CALIFORNIA STATE UNIVERSITY - SACREMENTO FOUNDATION,CALIFORNIA STATE UNIVERSITY - SACREMENTO FOUNDATION
CALIFORNIA STATE UNIVERSITY AT SAN MARCOS,CALIFORNIA STATE UNIVERSITY AT SAN MARCOS,CALIFORNIA STATE UNIVERSITY AT SAN MARCOS
CANCER RESEARCH INSTITUTE OF CONTRA COSTA,CANCER RESEARCH INSTITUTE OF CONTRA COSTA,CANCER RESEARCH INSTITUTE OF CONTRA COSTA
"CARNEGIE INSTITUTION OF WASHINGTON, D.C.",,RELEVANT INSTITUTION NOT IN AGREEMENTS
CARNEGIE MELLON UNIVERSITY,CARNEGIE MELLON UNIVERSITY,CARNEGIE MELLON UNIVERSITY
CAROLINAS MEDICAL CENTER,CAROLINAS MEDICAL CENTER,CAROLINAS MEDICAL CENTER
CASE WESTERN RESERVE UNIVERSITY,CASE WESTERN RESERVE UNIVERSITY,CASE WESTERN RESERVE UNIVERSITY
CATHOLIC UNIVERSITY OF AMERICA,THE CATHOLIC UNIVERSITY OF AMERICA,THE CATHOLIC UNIVERSITY OF AMERICA
CEDARS-SINAI MEDICAL CENTER,CEDARS-SINAI MEDICAL CENTER,CEDARS-SINAI MEDICAL CENTER
CENTER FOR BLOOD RESEARCH,,RELEVANT INSTITUTION NOT IN AGREEMENTS
CENTER FOR HEALTH ECONOMICS RESEARCH,,RELEVANT INSTITUTION NOT IN AGREEMENTS
CENTER FOR HEALTH STUDIES,,RELEVANT INSTITUTION NOT IN AGREEMENTS
CENTER FOR MOLECULAR MEDICINE AND IMMUNOLOGY,CENTER FOR MOLECULAR MEDICINE AND IMMUNOLOGY,CENTER FOR MOLECULAR MEDICINE AND IMMUNOLOGY
CENTRAL INSTITUTE FOR THE DEAF,,RELEVANT INSTITUTION NOT IN AGREEMENTS
CENTRAL MICHIGAN UNIVERSITY,CENTRAL MICHIGAN UNIVERSITY,CENTRAL MICHIGAN UNIVERSITY
CENTRAL NEW YORK RESEARCH CORPORATION,CENTRAL NEW YORK RESEARCH CORPORATION,CENTRAL NEW YORK RESEARCH CORPORATION
CHARLES F. KETTERING FOUNDATION RESEARCH LAB,,RELEVANT INSTITUTION NOT IN AGREEMENTS
CHARLES R. DREW UNIVERSITY OF MEDICINE AND SCIENCE,CHARLES R. DREW UNIVERSITY OF MEDICINE AND SCIENCE,CHARLES R. DREW UNIVERSITY OF MEDICINE AND SCIENCE
CHESTNUT HEALTH SYSTEMS INC,CHESTNUT HEALTH SYSTEMS,CHESTNUT HEALTH SYSTEMS
CHICAGO COLLEGE OF OSTEOPATHIC MEDICINE,,RELEVANT INSTITUTION NOT IN AGREEMENTS
"CHILD TRENDS, INC.","CHILD TRENDS, INC.","CHILD TRENDS, INC."
CHILDRENS HOSPITAL (BUFFALO),,RELEVANT INSTITUTION NOT IN AGREEMENTS
CHILDRENS HOSPITAL (DENVER),THE CHILDREN'S HOSPITAL,THE CHILDREN'S HOSPITAL
CHILDRENS HOSPITAL AND REGIONAL MEDICAL CENTER (SEATTLE),CHILDREN'S HOSPITAL AND REGIONAL MEDICAL CENTER,CHILDREN'S HOSPITAL AND REGIONAL MEDICAL CENTER
CHILDRENS HOSPITAL MEDICAL CENTER OF CINCINNATI,CHILDREN'S HOSPITAL MEDICAL CENTER OF CINCINNATI,CHILDREN'S HOSPITAL MEDICAL CENTER OF CINCINNATI
CHILDRENS HOSPITAL OF BOSTON,CHILDREN'S HOSPITAL OF BOSTON,CHILDREN'S HOSPITAL OF BOSTON
CHILDRENS HOSPITAL OF COLUMBUS,CHILDREN'S HOSPITAL OF COLUMBUS,CHILDREN'S HOSPITAL OF COLUMBUS
CHILDRENS HOSPITAL OF LOS ANGELES,CHILDREN'S HOSPITAL OF LOS ANGELES,CHILDREN'S HOSPITAL OF LOS ANGELES
CHILDRENS HOSPITAL OF OAKLAND,CHILDREN'S HOSPITAL OF OAKLAND,CHILDREN'S HOSPITAL OF OAKLAND
CHILDRENS HOSPITAL OF PHILADELPHIA,CHILDREN'S HOSPITAL OF PHILADELPHIA,CHILDREN'S HOSPITAL OF PHILADELPHIA
CHILDRENS HOSPITAL RESEARCH CENTER (SAN DIEGO),CHILDREN'S HOSPITAL RESEARCH CENTER,CHILDREN'S HOSPITAL RESEARCH CENTER
CHILDRENS MEMORIAL HOSPITAL (CHICAGO),CHILDREN'S MEMORIAL HOSPITAL,CHILDREN'S MEMORIAL HOSPITAL
"CHILDRENS MERCY HOSPITAL (KANSAS CITY, MO)",CHILDRENS MERCY HOSPITAL,CHILDRENS MERCY HOSPITAL
"CHILDRENS RESEARCH INSTITUTE (WASHINGTON, DC)",CHILDREN'S RESEARCH INSTITUTE,CHILDREN'S RESEARCH INSTITUTE
CHRIST HOSPITAL (CINCINNATI),,RELEVANT INSTITUTION NOT IN AGREEMENTS
CLAREMONT GRADUATE UNIVERSITY,CLAREMONT GRADUATE UNIVERSITY,CLAREMONT GRADUATE UNIVERSITY
CLARIAN HEALTH PARTNERS INC,"CLARIAN HEALTH PARTNERS, INC.","CLARIAN HEALTH PARTNERS, INC."
CLARK UNIVERSITY (WORCESTER MA),CLARK UNIVERSITY,CLARK UNIVERSITY
CLARKSON UNIVERSITY,CLARKSON UNIVERSITY,CLARKSON UNIVERSITY
CLEMSON UNIVERSITY,CLEMSON UNIVERSITY,CLEMSON UNIVERSITY
CLEVELAND CLINIC FOUNDATION,CLEVELAND CLINIC FOUNDATION,CLEVELAND CLINIC FOUNDATION
CLEVELAND STATE UNIVERSITY,CLEVELAND STATE UNIVERSITY,CLEVELAND STATE UNIVERSITY
COLD SPRING HARBOR LABORATORY,COLD SPRING HARBOR LABORATORY,COLD SPRING HARBOR LABORATORY
COLLEGE OF MEDICINE AT PEORIA,,RELEVANT INSTITUTION NOT IN AGREEMENTS
COLLEGE OF MEDICINE AT ROCKFORD,,RELEVANT INSTITUTION NOT IN AGREEMENTS
COLLEGE OF WILLIAM AND MARY,THE COLLEGE OF WILLIAM AND MARY,THE COLLEGE OF WILLIAM AND MARY
COLLEGE OF WILLIAM AND MARY,WILLIAM AND MARY,WILLIAM AND MARY
COLORADO STATE UNIVERSITY AT FORT COLLINS,COLORADO STATE UNIVERSITY,COLORADO STATE UNIVERSITY
COLUMBIA UNIVERSITY IN THE CITY OF NEW YORK,COLUMBIA UNIVERSITY,COLUMBIA UNIVERSITY
COLUMBIA UNIVERSITY TEACHERS COLLEGE,TEACHERS COLLEGE OF COLUMBIA UNIVERSITY,TEACHERS COLLEGE OF COLUMBIA UNIVERSITY
CORIELL INSTITUTE FOR MEDICAL RESEARCH,CORIELL INSTITUTE FOR MEDICAL RESEARCH,CORIELL INSTITUTE FOR MEDICAL RESEARCH
CORNELL COLLEGE,CORNELL COLLEGE,CORNELL COLLEGE
CORNELL UNIVERSITY,CORNELL UNIVERSITY,CORNELL UNIVERSITY
CREIGHTON UNIVERSITY,CREIGHTON UNIVERSITY,CREIGHTON UNIVERSITY
CTRC RESEARCH FOUNDATION,CANCER THERAPY AND RESEARCH CENTER,CANCER THERAPY AND RESEARCH CENTER
CUNY - BARUCH COLLEGE,CUNY - BARUCH COLLEGE,CUNY - BARUCH COLLEGE
CUNY - BROOKLYN COLLEGE,CUNY - BROOKLYN COLLEGE,CUNY - BROOKLYN COLLEGE
CUNY - CITY COLLEGE,CUNY - CITY COLLEGE,CUNY - CITY COLLEGE
CUNY - COLLEGE OF STATEN ISLAND,CUNY - COLLEGE OF STATEN ISLAND,CUNY - COLLEGE OF STATEN ISLAND
CUNY - GRADUATE CENTER,CUNY - GRADUATE CENTER,CUNY - GRADUATE CENTER
CUNY - HUNTER COLLEGE,CUNY - HUNTER COLLEGE,CUNY - HUNTER COLLEGE
CUNY - JOHN JAY COLLEGE,CUNY - JOHN JAY COLLEGE,CUNY - JOHN JAY COLLEGE
CUNY - LEHMAN COLLEGE,CUNY - LEHMAN COLLEGE,CUNY - LEHMAN COLLEGE
CUNY - QUEENS COLLEGE,CUNY - QUEENS COLLEGE,CUNY - QUEENS COLLEGE
CUNY - YORK COLLEGE,CUNY - YORK COLLEGE,CUNY - YORK COLLEGE
DANA-FARBER CANCER INSTITUTE,DANA FARBER CANCER INSTITUTE,DANA FARBER CANCER INSTITUTE
DARTMOUTH COLLEGE,DARTMOUTH COLLEGE,DARTMOUTH COLLEGE
DE PAUL UNIVERSITY,DEPAUL UNIVERSITY,DEPAUL UNIVERSITY
DENVER CENTER FOR THE PERFORMING ARTS,DENVER CENTER FOR THE PERFORMING ARTS,DENVER CENTER FOR THE PERFORMING ARTS
DOHENY EYE INSTITUTE,DOHENY EYE INSTITUTE,DOHENY EYE INSTITUTE
DONALD DANFORTH PLANT SCIENCE CENTER,,RELEVANT INSTITUTION NOT IN AGREEMENTS
DONALD GUTHRIE FOUNDATION FOR MEDICAL RESEARCH,"DONALD GUTHRIE FOUNDATION FOR MEDICAL RESEARCH,INC","DONALD GUTHRIE FOUNDATION FOR MEDICAL RESEARCH,INC"
DREXEL UNIVERSITY,DREXEL UNIVERSITY,DREXEL UNIVERSITY
DREXEL UNIVERSITY COLLEGE OF MEDICINE,,RELEVANT INSTITUTION NOT IN AGREEMENTS
DUKE UNIVERSITY,DUKE UNIVERSITY,DUKE UNIVERSITY
DUQUESNE UNIVERSITY,DUQUESNE UNIVERSITY,DUQUESNE UNIVERSITY
EAST CAROLINA UNIVERSITY,EAST CAROLINA UNIVERSITY,EAST CAROLINA UNIVERSITY
EAST TENNESSEE STATE UNIVERSITY,EAST TENNESSEE STATE UNIVERSITY,EAST TENNESSEE STATE UNIVERSITY
EAST-WEST CENTER,,RELEVANT INSTITUTION NOT IN AGREEMENTS
EASTERN VIRGINIA MEDICAL SCHOOL,EASTERN VIRGINIA MEDICAL SCHOOL,EASTERN VIRGINIA MEDICAL SCHOOL
EASTERN VIRGINIA MEDICAL SCHOOL,MEDICAL COLLEGE OF HAMPTON ROADS,MEDICAL COLLEGE OF HAMPTON ROADS
EDUCATION DEVELOPMENT CENTER INC,"EDUCATION DEVELOPMENT CENTER, INC.","EDUCATION DEVELOPMENT CENTER, INC."
EDUCATIONAL TESTING SERVICE,,RELEVANT INSTITUTION NOT IN AGREEMENTS
ELEANOR ROOSEVELT INSTITUTE FOR CANCER RESEARCH,,RELEVANT INSTITUTION NOT IN AGREEMENTS
ELLIS FISCHEL STATE CANCER CENTER,,RELEVANT INSTITUTION NOT IN AGREEMENTS
EMMA PENDLETON BRADLEY HOSPITAL,BRADLEY HOSPITAL/LIFESPAN,BRADLEY HOSPITAL/LIFESPAN
EMORY UNIVERSITY,EMORY UNIVERSITY,EMORY UNIVERSITY
ERNEST GALLO CLINIC AND RESEARCH CENTER,ERNEST GALLO CLINIC AND RESEARCH CENTER,ERNEST GALLO CLINIC AND RESEARCH CENTER
EUNICE KENNEDY SHRIVER CENTER FOR MENTAL RETARDATION,,RELEVANT INSTITUTION NOT IN AGREEMENTS
EVANSTON HOSPITAL,EVANSTON NORTHWESTERN HEALTHCARE,EVANSTON NORTHWESTERN HEALTHCARE
FAIRLEIGH DICKINSON UNIVERSITY,FAIRLEIGH DICKINSON UNIVERSITY,FAIRLEIGH DICKINSON UNIVERSITY
FAMILY HEALTH INTERNATIONAL,,RELEVANT INSTITUTION NOT IN AGREEMENTS
FATHER FLANAGANS BOYS HOME,FATHER FLANAGAN'S BOYS' HOME,FATHER FLANAGAN'S BOYS' HOME
FEINSTEIN INSTITUTE FOR MEDICAL RESEARCH,,RELEVANT INSTITUTION NOT IN AGREEMENTS
FLORIDA ATLANTIC UNIVERSITY,FLORIDA ATLANTIC UNIVERSITY,FLORIDA ATLANTIC UNIVERSITY
FLORIDA INSTITUTE OF TECHNOLOGY,FLORIDA INSTITUTE OF TECHNOLOGY,FLORIDA INSTITUTE OF TECHNOLOGY
FLORIDA INTERNATIONAL UNIVERSITY,FLORIDA INTERNATIONAL UNIVERSITY,FLORIDA INTERNATIONAL UNIVERSITY
FLORIDA STATE UNIVERSITY,FLORIDA STATE UNIVERSITY,FLORIDA STATE UNIVERSITY
FORDHAM UNIVERSITY,FORDHAM UNIVERSITY,FORDHAM UNIVERSITY
FORSYTH INSTITUTE,THE FORSYTH INSTITUTE,THE FORSYTH INSTITUTE
FOUNDATION FOR BLOOD RESEARCH,FOUNDATION FOR BLOOD RESEARCH,FOUNDATION FOR BLOOD RESEARCH
FOX CHASE CANCER CENTER,THE FOX CHASE CANCER CENTER,THE FOX CHASE CANCER CENTER
FRANKLIN AND MARSHALL COLLEGE,FRANKLIN AND MARSHALL COLLEGE,FRANKLIN AND MARSHALL COLLEGE
FRED HUTCHINSON CANCER RESEARCH CENTER,FRED HUTCHINSON CANCER RESEARCH CENTER,FRED HUTCHINSON CANCER RESEARCH CENTER
"FRIENDS RESEARCH INSTITUTE, INC.","FRIENDS RESEARCH INSTITUTE, INC.","FRIENDS RESEARCH INSTITUTE, INC."
"FRONTIER SCIENCE AND TECHNOLOGY RESEARCH FOUNDATION,INC.","FRONTIER SCIENCE AND TECHNOLOGY RESEARCH FOUNDATION,INC.","FRONTIER SCIENCE AND TECHNOLOGY RESEARCH FOUNDATION,INC."
GALLAUDET UNIVERSITY,GALLAUDET COLLEGE,GALLAUDET COLLEGE
GALLAUDET UNIVERSITY,GALLAUDET UNIVERSITY,GALLAUDET UNIVERSITY
GEISINGER MEDICAL CENTER,GEISINGER CLINIC,GEISINGER CLINIC
GEISINGER MEDICAL CENTER,GEISINGER MEDICAL CENTER,PENNSYLVANIA STATE UNIVERSITY
GENESEE HOSPITAL,,RELEVANT INSTITUTION NOT IN AGREEMENTS
GEORGE MASON UNIVERSITY,GEORGE MASON UNIVERSITY,GEORGE MASON UNIVERSITY
GEORGE WASHINGTON UNIVERSITY,THE GEORGE WASHINGTON UNIVERSITY,THE GEORGE WASHINGTON UNIVERSITY
GEORGETOWN UNIVERSITY,GEORGETOWN UNIVERSITY,GEORGETOWN UNIVERSITY
GEORGIA INSTITUTE OF TECHNOLOGY,GEORGIA INSTITUTE OF TECHNOLOGY,GEORGIA INSTITUTE OF TECHNOLOGY
GEORGIA INSTITUTE OF TECHNOLOGY,GEORGIA INSTITUTE OF TECHNOLOGY GEORGIA,GEORGIA INSTITUTE OF TECHNOLOGY GEORGIA
GEORGIA SOUTHERN UNIVERSITY,GEORGIA SOUTHERN UNIVERSITY,GEORGIA SOUTHERN UNIVERSITY
GEORGIA STATE UNIVERSITY,GEORGIA STATE UNIVERSITY,GEORGIA STATE UNIVERSITY
GEORGIA STATE UNIVERSITY,GEORGIA STATE UNIVERSITY AND GEORGIA STATE UNIVERSITY RESEARCH FOUNDATION,GEORGIA STATE UNIVERSITY AND GEORGIA STATE UNIVERSITY RESEARCH FOUNDATION
"GOOD SAMARITAN HOSPITAL (LOS ANGELES, CA)",GOOD SAMARITAN HOSPITAL,GOOD SAMARITAN HOSPITAL
"GOOD SAMARITAN HOSPITAL AND MEDICAL CENTER (PORTLAND, OR)",,RELEVANT INSTITUTION NOT IN AGREEMENTS
"GOOD SAMARITAN MEDICAL CENTER (CORVALLIS, OR)",,RELEVANT INSTITUTION NOT IN AGREEMENTS
GRADUATE HOSPITAL (PHILADELPHIA),,RELEVANT INSTITUTION NOT IN AGREEMENTS
GROUP HEALTH COOPERATIVE OF PUGET SOUND,GROUP HEALTH COOPERATIVE,GROUP HEALTH COOPERATIVE
GULF SOUTH RESEARCH INSTITUTE,,RELEVANT INSTITUTION NOT IN AGREEMENTS
HARLEM HOSPITAL CENTER,,RELEVANT INSTITUTION NOT IN AGREEMENTS
HARTFORD HOSPITAL,HARTFORD HOSPITAL,HARTFORD HOSPITAL
HARVARD MEDICAL SCHOOL,HARVARD MEDICAL SCHOOL,HARVARD MEDICAL SCHOOL
HARVARD MEDICAL SCHOOL,HARVARD MEDICAL SCHOOL,HARVARD UNIVERSITY
HARVARD MEDICAL SCHOOL,HARVARD MEDICAL SCHOOL,HARVARD UNIVERSITY SCHOOL OF PUBLIC HEALTH
HARVARD PILGRIM HEALTH CARE INC,"HARVARD PILGRIM HEALTH CARE, INC.","HARVARD PILGRIM HEALTH CARE, INC."
HARVARD UNIVERSITY,HARVARD UNIVERSITY,HARVARD UNIVERSITY
HARVARD UNIVERSITY SCHOOL OF PUBLIC HEALTH,HARVARD SCHOOL OF PUBLIC HEALTH,HARVARD SCHOOL OF PUBLIC HEALTH
HARVARD UNIVERSITY SCHOOL OF PUBLIC HEALTH,HARVARD UNIVERSITY SCHOOL OF PUBLIC HEALTH,HARVARD MEDICAL SCHOOL
HARVARD UNIVERSITY SCHOOL OF PUBLIC HEALTH,HARVARD UNIVERSITY SCHOOL OF PUBLIC HEALTH,HARVARD UNIVERSITY
HARVARD UNIVERSITY SCHOOL OF PUBLIC HEALTH,HARVARD UNIVERSITY SCHOOL OF PUBLIC HEALTH,HARVARD UNIVERSITY SCHOOL OF PUBLIC HEALTH
HASKINS LABORATORIES,HASKINS LABORATORIES,HASKINS LABORATORIES
HASTINGS CENTER INC,THE HASTINGS CENTER,THE HASTINGS CENTER
"HAUPTMAN-WOODWARD MEDICAL RESEARCH INSTITUTE, INC.","HAUPTMAN-WOODWARD MEDICAL RESEARCH INSTITUTE, INC.","HAUPTMAN-WOODWARD MEDICAL RESEARCH INSTITUTE, INC."
HAVERFORD COLLEGE,THE CORPORATION OF HAVERFORD COLLEGE,THE CORPORATION OF HAVERFORD COLLEGE
HEALTH PARTNERS RESEARCH FOUNDATION,HEALTH PARTNERS RESEARCH FOUNDATION,HEALTH PARTNERS RESEARCH FOUNDATION
HEBREW HOME OF GREATER WASHINGTON,HEBREW HOME OF GREATER WASHINGTON,HEBREW HOME OF GREATER WASHINGTON
HEBREW REHABILITATION CENTER FOR AGED,HEBREW REHABILITATION CENTER FOR AGED,HEBREW REHABILITATION CENTER FOR AGED
HEKTOEN INSTITUTE FOR MEDICAL RESEARCH,HEKTOEN INSTITUTE FOR MEDICAL RESEARCH,HEKTOEN INSTITUTE FOR MEDICAL RESEARCH
HELEN HAYES HOSPITAL,,RELEVANT INSTITUTION NOT IN AGREEMENTS
HENNEPIN COUNTY MEDICAL CENTER,,RELEVANT INSTITUTION NOT IN AGREEMENTS
HENRY FORD HEALTH SYSTEM,HENRY FORD HEALTH SYSTEM IDC,HENRY FORD HEALTH SYSTEM IDC
HENRY M. JACKSON FOUNDATION FOR THE ADVANCEMENT OF MILITARY MEDICINE,,RELEVANT INSTITUTION NOT IN AGREEMENTS
"HISPANIC HEALTH COUNCIL, INC.","HISPANIC HEALTH COUNCIL, INC.","HISPANIC HEALTH COUNCIL, INC."
HOFSTRA UNIVERSITY,HOFSTRA UNIVERSITY,HOFSTRA UNIVERSITY
HOPE COLLEGE,HOPE COLLEGE,HOPE COLLEGE
HOSPITAL FOR JOINT DISEASES ORTHOPAEDIC INSTITUTE,HOSPITAL FOR JOINT DISEASES ORTHOPAEDIC INSTITUTE,HOSPITAL FOR JOINT DISEASES ORTHOPAEDIC INSTITUTE
HOSPITAL FOR SPECIAL SURGERY,HOSPITAL FOR SPECIAL SURGERY,HOSPITAL FOR SPECIAL SURGERY
HOUSE EAR INSTITUTE,HOUSE EAR INSTITUTE,HOUSE EAR INSTITUTE
HOWARD UNIVERSITY,HOWARD UNIVERSITY,HOWARD UNIVERSITY
HUMAN INTERACTION RESEARCH INSTITUTE,HUMAN INTERACTION RESEARCH INSTITUTE,HUMAN INTERACTION RESEARCH INSTITUTE
HUNTINGTON MEDICAL RESEARCH INSTITUTES,HUNTINGTON MEDICAL RESEARCH INSTITUTE,HUNTINGTON MEDICAL RESEARCH INSTITUTE
IDAHO STATE UNIVERSITY,IDAHO STATE UNIVERSITY,IDAHO STATE UNIVERSITY
IIT RESEARCH INSTITUTE,,RELEVANT INSTITUTION NOT IN AGREEMENTS
ILLINOIS INSTITUTE OF TECHNOLOGY,ILLINOIS INSTITUTE OF TECHNOLOGY,ILLINOIS INSTITUTE OF TECHNOLOGY
ILLINOIS STATE PSYCHIATRIC INSTITUTE,,RELEVANT INSTITUTION NOT IN AGREEMENTS
ILLINOIS STATE UNIVERSITY,ILLINOIS STATE UNIVERSITY,ILLINOIS STATE UNIVERSITY
INDIANA STATE UNIVERSITY,INDIANA STATE UNIVERSITY/TERRE HAUTE,INDIANA STATE UNIVERSITY/TERRE HAUTE
INDIANA UNIVERSITY,INDIANA UNIVERSITY,INDIANA UNIVERSITY
INDIANA UNIVERSITY - PURDUE UNIVERSITY AT INDIANAPOLIS,,RELEVANT INSTITUTION NOT IN AGREEMENTS
INDIANAPOLIS CENTER FOR ADVANCED RESEARCH,,RELEVANT INSTITUTION NOT IN AGREEMENTS
INSTITUTE FOR CANCER PREVENTION,INSTITUTION FOR CANCER PREVENTION,INSTITUTION FOR CANCER PREVENTION
INSTITUTE FOR COMMUNITY RESEARCH,"THE INSTITUTE FOR COMMUNITY RESEARCH, INC.","THE INSTITUTE FOR COMMUNITY RESEARCH, INC."
INSTITUTE FOR GENOMIC RESEARCH,,RELEVANT INSTITUTION NOT IN AGREEMENTS
INSTITUTE FOR RESEARCH IN SOCIAL BEHAVIOR,,RELEVANT INSTITUTION NOT IN AGREEMENTS
INSTITUTE OF APPLIED PHYSIOLOGY AND MEDICINE,,RELEVANT INSTITUTION NOT IN AGREEMENTS
INSTITUTES FOR BEHAVIOR RESOURCES INC,"INSTITUTES FOR BEHAVIOR RESOURCES, INC.","INSTITUTES FOR BEHAVIOR RESOURCES, INC."
IOWA STATE UNIVERSITY,IOWA STATE UNIVERSITY,IOWA STATE UNIVERSITY
JACKSON STATE UNIVERSITY,JACKSON STATE UNIVERSITY,JACKSON STATE UNIVERSITY
JEWISH HOSPITAL AND MEDICAL CENTER OF BROOKLYN,,RELEVANT INSTITUTION NOT IN AGREEMENTS
JEWISH HOSPITAL OF SAINT LOUIS,,RELEVANT INSTITUTION NOT IN AGREEMENTS
"JOHN B. PIERCE LABORATORY, INC.","THE JOHN B. PIERCE LABORATORY, INC.","THE JOHN B. PIERCE LABORATORY, INC."
JOHN WAYNE CANCER INSTITUTE,JOHN WAYNE CANCER INSTITUTE,JOHN WAYNE CANCER INSTITUTE
JOHNS HOPKINS UNIVERSITY,THE JOHNS HOPKINS UNIVERSITY,THE JOHNS HOPKINS UNIVERSITY
JOSLIN DIABETES CENTER,JOSLIN DIABETES CENTER,JOSLIN DIABETES CENTER
JUDGE BAKER CHILDRENS CENTER,JUDGE BAKER CHILDREN'S CENTER,JUDGE BAKER CHILDREN'S CENTER
KAISER FOUNDATION RESEARCH INSTITUTE - SOUTHERN CALIFORNIA REGION,KAISER FOUNDATION RESEARCH INSTITUTE - SOUTHERN CALIFORNIA REGION,KAISER FOUNDATION RESEARCH INSTITUTE - SOUTHERN CALIFORNIA REGION
KANSAS STATE UNIVERSITY,KANSAS STATE UNIVERSITY,KANSAS STATE UNIVERSITY
KARMANOS CANCER INSTITUTE,,RELEVANT INSTITUTION NOT IN AGREEMENTS
KENNEDY KRIEGER RESEARCH INSTITUTE,"KENNEDY KRIEGER RESEARCH INSTITUTE, INC.","KENNEDY KRIEGER RESEARCH INSTITUTE, INC."
KENT STATE UNIVERSITY AT KENT,KENT STATE UNIVERSITY,KENT STATE UNIVERSITY
KENYON COLLEGE,KENYON COLLEGE,KENYON COLLEGE
KIRKSVILLE COLLEGE OF OSTEOPATHIC MEDICINE,KIRKSVILLE COLLEGE OF OSTEOPATHIC MEDICINE,KIRKSVILLE COLLEGE OF OSTEOPATHIC MEDICINE
KLINE INSTITUTE FOR PSYCHIATRIC RESEARCH,KLINE RESEARCH CENTER,"RESEARCH FOUNDATION FOR MENTAL HYGIENE, INC."
KUAKINI MEDICAL CENTER,KUAKINI MEDICAL CENTER,KUAKINI MEDICAL CENTER
LA JOLLA BIOENGINEERING INSTITUTE,LA JOLLA BIOENGINEERING INSTITUTE,LA JOLLA BIOENGINEERING INSTITUTE
LA JOLLA INSTITUTE,,RELEVANT INSTITUTION NOT IN AGREEMENTS
LA JOLLA INSTITUTE FOR ALLERGY & IMMUNOLOGY,LA JOLLA INSTITUTE FOR ALLERGY AND IMMUNOLOGY,LA JOLLA INSTITUTE FOR ALLERGY AND IMMUNOLOGY
LA JOLLA INSTITUTE FOR MOLECULAR MEDICINE,LA JOLLA INSTITUTE FOR MOLECULAR MEDICINE,LA JOLLA INSTITUTE FOR MOLECULAR MEDICINE
LAHEY CLINIC,LAHEY CLINIC,LAHEY CLINIC
LANKENAU INSTITUTE FOR MEDICAL RESEARCH,"LANKENAU INSTITUTE FOR MEDICAL RESEARCH, INC","LANKENAU INSTITUTE FOR MEDICAL RESEARCH, INC"
LANTERMAN STATE HOSPITAL AND DEVELOPMENT CENTER,,RELEVANT INSTITUTION NOT IN AGREEMENTS
LDS HOSPITAL,LDS HOSPITAL,LDS HOSPITAL
LEGACY EMANUEL HOSPITAL AND HEALTH CENTER,LEGACY EMANUEL HOSPITAL AND HEALTH CENTER,LEGACY EMANUEL HOSPITAL AND HEALTH CENTER
LEHIGH UNIVERSITY,LEHIGH UNIVERSITY,LEHIGH UNIVERSITY
LEHIGH UNIVERSITY,LEIGH HIGH UNIVERSITY,LEIGH HIGH UNIVERSITY
LIGHTHOUSE INTERNATIONAL,LIGHTHOUSE INTERNATIONAL,LIGHTHOUSE INTERNATIONAL
LINUS PAULING INSTITUTE,,RELEVANT INSTITUTION NOT IN AGREEMENTS
LOMA LINDA UNIVERSITY,LOMA LINDA UNIVERSITY,LOMA LINDA UNIVERSITY
LOMA LINDA VETERANS ASSOCIATION FOR RESEARCH EDUCATION,,RELEVANT INSTITUTION NOT IN AGREEMENTS
LONG BEACH MEMORIAL MEDICAL CENTER,,RELEVANT INSTITUTION NOT IN AGREEMENTS
LOS ANGELES BIOMEDICAL RESEARCH INSTITUTE (HARBOR UCLA MEDICAL CENTER),LOS ANGELES BIOMEDICAL RESEARCH INSTITUTE,LOS ANGELES BIOMEDICAL RESEARCH INSTITUTE
LOS ANGELES COUNTY - HARBOR-UCLA MEDICAL CENTER,,RELEVANT INSTITUTION NOT IN AGREEMENTS
LOS ANGELES COUNTY - UNIVERSITY OF SOUTHERN CALIFORNIA MEDICAL CENTER,,RELEVANT INSTITUTION NOT IN AGREEMENTS
LOUISIANA STATE UNIVERSITY AGRICULTURAL AND MECHANICAL COLLEGE AT BATON ROUGE,LOUISIANA STATE UNIVERSITY,LOUISIANA STATE UNIVERSITY
LOUISIANA STATE UNIVERSITY AT SHREVEPORT,LOUISIANA STATE UNIVERSITY AT SHREVEPORT CAMPUS,LOUISIANA STATE UNIVERSITY AT SHREVEPORT CAMPUS
